id_cas;cas_numEtude;id_temoignage;tem_new;tem_chrono;obs_chrono;tem_nom_dossier;tem_title_nickname;tem_title_type;tem_resume;tem_Gi;tem_Ti;tem_Ti_type;tem_TComi;tem_age;tem_genre;tem_adr_commune;tem_adr_CP;tem_adr_dpt;tem_adr_pays;tem_xp_formation_niveau_type;tem_xp_activite_type;tem_xp_aero;tem_xp_aero_niveau;tem_xp_astro;tem_xp_astro_niveau;tem_xp_topo;tem_xp_topo_niveau;tem_xp_UFO;tem_xp_UFO_niveau;tem_obs_moyen;tem_emotions_lib;tem_activite_lib;tem_avis_interpretation_lib;tem_avis_interet_lib;tem_avis_change_lib;tem_avis_science_lib;tem_experience_change_lib;tem_photos_retouchees;tem_plans;tem_croquis;tem_public;tem_GD;tem_A;tem_PVi;tem_numSEPRA;tem_catno;id_temoignage_old;nom_temoignage_old;id_observation;obs_nb;obs_description;obs_commune_or_trajet;obs_tem_dep;obs_tem_dep_label;obs_tem_dep_vitesse;obs_AAAA;obs_MM;obs_JJ;obs_date_heure;obs_heure_plage;obs_heure_deb;obs_heure_fin;obs_heure;obs_heure_delta;obs_heure_tranche_horaire;obs_heure_approx;obs_duree_hms;obs_duree_lib;obs_duree_type;obs_1_adr_commune;obs_1_adr_CP;obs_1_adr_dpt;obs_1_adr_pays;obs_1_adr_commune_2;obs_1_adr_CP_2;obs_1_adr_dpt_2;obs_1_adr_pays_2;obs_1_cadre_reference;obs_1_cadre_reference_type;obs_1_lat;obs_1_lon;obs_1_pos_err;obs_1_env_sol;obs_1_env_sol_type;obs_1_env_relief_type;obs_conditions_tem_activite;obs_1_heure;obs_1_duree_type;obs_1_azimut;obs_1_azimut_lib;obs_1_elevation;obs_1_elevation_lib;obs_1_dist_lib;obs_1_dist_approx_type;obs_1_alt;obs_1_alt_lib;obs_1_cap;obs_1_cap_lib;obs_1_trajectoire_types;obs_1_trajectoire_lib;obs_1_dynamique_types;obs_1_vitesse_ang;obs_1_vitesse_lib;obs_1_vitesse_types;obs_1_taille_apparente_lib;obs_1_taille_apparente_type;obs_1_taille_apparente_abs;obs_1_env_odeurs_types;obs_1_tem_reaction_types;obs_conditions_apparition;obs_conditions_apparition_txt;obs_conditions_obs_direct;obs_conditions_obs_indirect;obs_conditions_env_bruit;obs_conditions_tem_activite_lib;obs_conditions_meteo;obs_conditions_meteo_lib;obs_conditions_astro;obs_conditions_astro_lib;obs_conditions_emotions;obs_1_forme_lib;obs_1_forme_types;obs_1_PAN_nature;obs_1_PAN_nature_type;obs_1_caracteristiques_types;obs_1_couleur_lib;obs_1_couleur_types;obs_1_luminosite_lib;obs_1_luminosite_types;obs_1_halo_lib;obs_1_bruit_lib;obs_1_bruit_nature_types;obs_1_bruit_intensite_types;obs_1_PAN_taille;obs_1_PAN_altitude;obs_1_distance_abs;obs_1_PAN_pos_lat;obs_1_PAN_pos_lon;obs_1_PAN_pos_approx;obs_2_cadre_reference;obs_2_cadre_reference_type;obs_2_lat;obs_2_alt;obs_2_lon;obs_2_pos_err;obs_2_env_sol;obs_2_env_sol_type;obs_2_env_relief_type;obs_2_heure;obs_2_duree_type;obs_2_azimut;obs_2_azimut_lib;obs_2_elevation;obs_2_elevation_lib;obs_2_dist_lib;obs_2_dist_approx_type;obs_2_alt_lib;obs_2_cap;obs_2_cap_lib;obs_2_trajectoire_types;obs_2_trajectoire_lib;obs_2_dynamique_types;obs_2_vitesse_ang;obs_2_vitesse_lib;obs_2_vitesse_types;obs_2_taille_apparente_lib;obs_2_taille_apparente_type;obs_2_taille_apparente_abs;obs_2_env_odeurs_types;obs_2_tem_reaction_types;obs_2_forme_lib;obs_2_forme_types;obs_2_PAN_nature;obs_2_PAN_nature_type;obs_2_caracteristiques_types;obs_2_couleur_lib;obs_2_couleur_types;obs_2_luminosite_lib;obs_2_luminosite_types;obs_2_halo_lib;obs_2_bruit_lib;obs_2_bruit_nature_types;obs_2_bruit_intensite_types;obs_2_PAN_taille;obs_2_PAN_altitude;obs_2_distance_abs;obs_2_PAN_pos_lat;obs_2_PAN_pos_lon;obs_2_PAN_pos_approx;obs_3_adr_bat;obs_3_adr_num_voie;obs_3_adr_type_voie;obs_3_adr_nom_voie;obs_3_adr_commune;obs_3_adr_CP;obs_3_adr_dpt;obs_3_adr_pays;obs_3_adr_lieu;obs_3_cadre_reference;obs_3_cadre_reference_type;obs_3_lat;obs_3_alt;obs_3_lon;obs_3_pos_err;obs_3_env_sol;obs_3_env_sol_type;obs_3_env_relief_type;obs_3_heure;obs_3_duree_type;obs_3_azimut;obs_3_azimut_lib;obs_3_elevation;obs_3_elevation_lib;obs_3_dist_lib;obs_3_dist_approx_type;obs_3_alt_lib;obs_3_cap;obs_3_cap_lib;obs_3_trajectoire_types;obs_3_trajectoire_lib;obs_3_dynamique_types;obs_3_vitesse_ang;obs_3_vitesse_lib;obs_3_vitesse_types;obs_3_taille_apparente_lib;obs_3_taille_apparente_type;obs_3_taille_apparente_abs;obs_3_env_odeurs_types;obs_3_tem_reaction_types;obs_conditions_disparition;obs_conditions_disparition_txt;obs_3_forme_lib;obs_3_forme_types;obs_3_PAN_nature;obs_3_PAN_nature_type;obs_3_caracteristiques_types;obs_3_couleur_lib;obs_3_couleur_types;obs_3_luminosite_lib;obs_3_luminosite_types;obs_3_halo_lib;obs_3_bruit_lib;obs_3_bruit_nature_types;obs_3_bruit_intensite_types;obs_3_PAN_taille;obs_3_distance_abs;obs_3_PAN_altitude;obs_3_PAN_pos_lat;obs_3_PAN_pos_lon;obs_3_PAN_pos_approx;obs_incli;obs_incli_lib;obs_deg_parcouru;obs_nb_PAN;obs_nb_PAN_lib;obs_formation;obs_formation_type;obs_caracteristiques;obs_continuite;obs_continuite_type;obs_PAN_calculs;obs_envt_equipements_actifs
2;1937-01-01656;31;0;;1937.01.01;"MARIGOT (LE) (972) --.--.1937";;;;;1;T;;;H;;;;;;"48. Contremaetres, agents de maetrise";;;;;;;;;;;;;;;;;;;;O;5859;;1;1937309697;;;;29;1;;1;;;;1937;--;--;"1937-06-15 18:00:00";18:00;;;18:00:00;16848000;;;1m;;;"MARIGOT (LE)";97225;972;;;;;;;Ciel;14.8;-61;0.0;;"Territoires artificialises - Zones urbanisees";;;;;;"le Marigot";;80e;;;;;270.00;;Inconnu;;;;;Lente;"diametre superieur e celui de la Lune";"x < 0.04e ou ""Ponctuelle""";;;"Emotion - Curiosite, Interet - Actif";1;;;;;;"Soleil ou Nuit claire";;;;;;"3D - 2 axes de symetrie - Spherique, Boule";globe;Autre;"Objet unique";;Blanc;opaque;"Type - Nature: autre";;;Inconnu;;;;;;;;;;;;;0.0;;;;;;;;;;;;;;;;;;;;;;;;;;;;;" Phenomene";;;;;;;;;;;;;;;;;;;;;;;;;;;;;;0.0;;;;;;;"le Marigot";;;;;;;;Inconnu;;;;;;;;;;;0;;;;;;;;;;;;;;;;;;;;;;;;1;"Un seul";;;;;"Observation en continu";;
3;1951-06-00002;32;0;;1951.06.01;"[AERO MIL] ORANGE (84) 15.06.1951 T1";;;;;;T;1;;H;;;;;;"32. Cadres de la fonction publique, professions intellectuelles et  artistiques";;;;;;;;;;;;;;;;;;;;O;;126;;1951208633;51700450;;;30;1;;1;;;;1951;06;15;"1951-06-15 11:28:00";11:28;;;11:28:00;0;;;6m;"6 minutes";;ORANGE;84100;84;FR;;;;;;;44.1;4.8;0.1;;;;;;"10 mn env.";;;;;"tres eloigne entre 60 et 100 km";;;;;;;"trajectoire legerement montante evolution en fonction de l'avion";Stationnaire;;" vitesse de l'objet plus rapide que celle de l'avion (250noeuds)";;;;;;;;;;;;;;;;;;"Ronde, cigare";"3D - 2 axes de symetrie - Spherique, Boule";"Engin bizarre";;;;;;"Intensite - Forte ou lumineux, ex: ampoule (mag. -15 e -10)";;;;;;;;;;;;;;;;0.0;;;;;;;;;;;;;;;;;Stationnaire;;;;;;;;;;;;;;;;;;;;;;;;;;;;;;;;;;;;;;;;;;0.0;;;;;;;;;;;;;;;;;;;;;;;;;;;;;;;;;;;;;;;;;;;;;;;;;;1;"Un seul";;;;;;;
3;1951-06-00002;33;0;;1951.06.02;"[AERO MIL] ORANGE (84) 15.06.1951 T2";;;;;;T;2;;F;;;;;;"32. Cadres de la fonction publique, professions intellectuelles et  artistiques";;;;;;;;;;;;;;;;;;;;O;;185;;1951208633;51700450;;;31;1;;1;;;;1951;06;15;"1951-06-15 11:23:00";11:23;;;11:23:00;0;;;6m;"6 minutes";;ORANGE;84100;84;FR;;;;;;;44.1;4.8;0.1;;;;;;"10 mn env.";;;;;;;;;;;;eloignement;Stationnaire;;" nulle puis mobile";;"non ponctuelle";;;;;;;;;;;;;;;;;"3D - 2 axes de symetrie - Spherique, Boule";;;;;;;"Intensite - Forte ou lumineux, ex: ampoule (mag. -15 e -10)";;;;;;;;;;;;;;;;0.0;;;;;;;;;;;;;;;;;Stationnaire;;;;;;;;;;;;;;;;;;;;;;;;;;;;;;;;;;;;;;;;;;0.0;;;;;;;;;;;;;;;;;;;;;;;;;;;;;;;;;;;;;;;;;;;;;;;;;;1;"Un seul";;;;;;;
4;1951-08-00003;34;0;;1951.08.01;"BIARRITZ (64) --.08.1951";;;;;1;T;;"40 - 49 ans";H;;;;;;"36. Cadres d'entreprise";;;;;;;;;;;;;;;;;;;;O;5081;;1;1951309372;51300068;;;32;1;;1;;;;1951;08;--;"1951-08-15 00:00:00";00:00;;;00:00:00;1296000;;;10/15s;;;BIARRITZ;64200;64;FR;;;;;;Ciel;43.5;-1.6;0.0;"en bordure de falaise";"Surfaces en eau";;;;;45.00;;;"25 metres";;;42;;45.00;;"Lineaire ou Rectiligne";;;;" virage pris rapidement";;;;;;"Action - Fuite";1;;;;;;Inconnu;;;;;"2 assiettes e soupe accollees";"Autre forme non categorisee";"masse, deux assiettes accolees";Autre;"Objet unique";;;;Inconnue;;;"Aucun, Silence total";;;;;;;;;;;;;0.0;;;;;;;;;;;;;;;"Chg direction, niveau de vol";;;;;;;;;;"Emotion - Inquietude, Anxiete, Peur";;;;" Objet";;;;;;;;;;;;;;;;;;;;;;;;;;;;;;0.0;;;;;;315.00;;;;;;;270.00;;Inconnu;;;;;;;;;;;0;;;;;;;;;;;;;;;;;;;;;;;;1;"Un seul";;;;;"Observation en continu";;
5;1952-06-00004;35;0;;1952.06.01;"PORT-GENTIL (GA.8) 01.06.1952";;;;1;1;T;;;H;;;;;;"36. Cadres d'entreprise";;;;;;;;;;;;;;;;;;;;O;5862;;1;1952309700;52800469;;;33;1;;1;;;;1952;06;01;"1952-06-01 02:40:00";02:40;;;02:40:00;0;;;3m;;;PORT-GENTIL;;8;GA;;;;;;Ciel;-0.7;8.8;0.8;"rade de Port-Gentil GABON";"Surfaces en eau";;;;;;"vers les terres (Eou SE)";;"altitude de 3000 e 4000 metres";;;6;;180.00;" vers les terres (Eou SE)";"Lineaire ou Rectiligne";;;;;Rapide;planete;"x < 0.04e ou ""Ponctuelle""";;;"Emotion - Curiosite, Interet - Actif";1;;;;;;"Soleil ou Nuit claire";;;;;;"Sans forme precise";;" Objet";"Objet unique";;"Orange, feu";;"Intensite - Forte ou lumineux, ex: ampoule (mag. -15 e -10)";;;"Aucun, Silence total";;;;;;;;;;;;;0.0;;;;;;;;;;;;;;;Autre;"2 virages";;;;;;;;;;;;;" Phenomene";;;;;;;;;;;;;;;;;;;;;;;;;;;;;;0.0;;;;;;0.00;;;;;;;45.00;" cap 10e";"Lineaire ou Rectiligne";;;;;;;;;;;0;;;;;;;;;;;;;;;;;;;;;;;;1;"Un seul";;;;;"Observation en continu";;
6;1952-09-08193;37;0;2012.02.11;1952.09.01;"CRECY-EN-PONTHIEU (80) 21.09.1952";;;"Temoignage recent (22/11/2010) d'une observation ancienne
Le temoin, alors enfant, rentre de vacances dans la voiture de ses parents, lorsqu'ils sont arretes par un autre automobiliste au bord d'une route. Tout proche, un engin circulaire de couleur gris metallise stationne au-dessus d'un champ e environ 15m d'altitude. L'engin demarre subitement, puis redescend e sa position initiale et repart vers les nuages.";;1;T;;"10 - 19 ans";H;MARCQ-EN-BAROEUL;59700;59;FR;;"7. Retraites";;;;;;;;;;;;;;;;;;;;O;7101;;1;1952110624;;1463;"CRECY-EN-PONTHIEU (80) 21.09.1952";34;1;;1;;;;1952;09;21;"1952-09-21 12:00:00";;;;;43200;;5;3m;;;CRECY-EN-PONTHIEU;80150;80;FR;;;;;;"Paysage Rural";50.3;1.9;0.1;;"Territoires artificialises - Zones industrielles ou commerciales et reseaux de communication - Reseaux routier et ferroviaire et espaces associes";;;;;;"au milieu d'un champ de la campagne de Crecy en Ponthieu";;"15 m au dessu d'un champ";"30 m";"<50m (tres proche)";50;;0.00;;"Stationnaire, Immobile";;;;;Inconnu;"plus ou moins 5 m de diametre";;;;"Emotion - Curiosite, Interet - Actif";1;;;;;;"Belles eclaircies ou Peu nuageux";;;;;;"3D - 2 axes de symetrie - Spherique, Boule";;" Engin";"Objet unique";;;"lumiere verdatre passant e traver les hublots";"Type - Nature: autre";;;"Aucun, Silence total";;;;;;;;;;;;;0.0;;;;;;;;;;;;;;;Autre;"monte puis redescend au meme endroit";;;;;;;;;;;;;;;;;;;;;;;;;;;;;;;;;;;;;;;;50;;1;0.0;;;;;;;;;;;;;;;Montante;;;;;;;;;;;0;;;;;;;;;;;;;;;;;;;;;;;;1;"Un seul";;;;;"Observation en continu";;
7;1953-04-00005;40;0;;1953.04.02;"LIMOGES (87) 11.04.1953 T1";;;"Le temoin apereoit dans le ciel tres clair un gros point rouge orange qui se dirige d'Est en Ouest e tres haute altitude. En 8 minutes environ il parcoure aller et retour un secteur representant 45e de la route celeste, sa trajectoire n'est pas rectiligne mais en ligne brisee irreguliere formant des angles d'environ 15e sur l'axe du deplacement, les changements de cap s'effectuant toutes les secondes.
Le sens est-ouest a ete pris apres un virage de 180e exactement en prenant de l'altitude, et toujours par changements de cap successifs.
le temoin appelle l'adjudant-chef (pas de tem retrouve) et  la sentinelle du Cheteau-d'Eau le premiere classe (pas de tem retrouve). Ces temoins suivent durant 2 ou 3 minutes le point qui s'enfuie avec des changements de cap puis qui fait enfin un pique prolonge e la suite duquel il est  perdu de vue.
Aucune forme n'a pu etre distinguee, c'etait un gros point rond (?) d'une jolie couleur rouge orangee. Il se deplaeait sans aucun bruit, sans traenee lumineuse, les deux temoins le virent sous forme d'etoile qui s'enfuyait, sa couleur seule le distinguant des astres visibles.";;1;T;1;;H;;;;;;"32. Cadres de la fonction publique, professions intellectuelles et  artistiques";;;;;;;;;;;;;;;;;;;;O;5985;;1;1953309799;53700453;;;37;1;;1;;;;1953;04;11;"1953-04-11 21:10:00";21:10;;;21:10:00;0;;;8m;00:08;;LIMOGES;87000;87;FR;;;;;;Ciel;45.8;1.3;0.1;"entrepot de l'armee de l'air Limoges-Romanet";;;;;;;Est;;"tres haute altitude";NP;;270;;;;Autre;"aller-retour en prenant de l'altitude avec trajectoire en zig zag angle de 15e avec changment de cap toutes les secondes";;;" 15e par minute";;gros;"0.04 < x < 0.1e ou ""Tres petite/Minuscule""";;;"Emotion - Curiosite, Interet - Actif";1;;Direct;;NP;NP2;Inconnu;"ciel tres clair";;NP;;point;"1D - Ponctuel (point)";;" Objet";"Objet unique";"rouge orange";Rouge;NP;"Intensite - Forte ou lumineux, ex: ampoule (mag. -15 e -10)";non;aucun;"Aucun, Silence total";;;;;;;;;;;;;0.0;;;;;;;;;;;;;;;"Chg direction, niveau de vol";;;;;;;;;;;;;;" Phenomene";;;"Orange, feu";;;;;;;;;;;;;;;;;;;;;;;;;;;0.0;;;;;;;Ouest;;NP;;;;;;Autre;"trajectoire en zig zag";;;;;;;;;;0;"le PAN fait un pique prolonge et est perdu de vue";;;;;;;;;;;;;;;;;;;;;;"45e de la voute celeste";1;"Un seul";;;;;"Non precise";;NP
8;1953-11-00006;41;0;;1953.11.01;"VELIZY-VILLACOUBLAY (78) 03.11.1953";;;;;1;T;;;H;;;;;;"36. Cadres d'entreprise";;;;;;;;;;;;;;;;;;;;O;5861;;1;1953309699;53700451;;;38;1;;1;;;;1953;11;03;"1953-11-03 20:14:00";20:14;;;19:14:00;0;;;15m;;;VELIZY-VILLACOUBLAY;78140;78;;;;;;;Ciel;48.8;2.2;0.0;"tour de contrele d'un aerodrome base aerienne 107";;;;;;45.00;;;;;;;;90.00;;"Stationnaire, Immobile";;;;;"Nulle, Immobile, Stationnaire";planete;"x < 0.04e ou ""Ponctuelle""";;;"Emotion - Curiosite, Interet - Actif";1;;;;;;"Belles eclaircies ou Peu nuageux";;;;;"sphere avec un anneau";"Autre forme non categorisee";;" Objet";"Objet unique";;Blanc;;"Intensite - Forte ou lumineux, ex: ampoule (mag. -15 e -10)";;;Inconnu;;;;;;;;;;;;;0.0;;;;;;;;;;;;;;;;;;;;;;;;;;;;;" Phenomene";;;;;;;;;;;;;;;;;;;;;;;;;;;;;;0.0;;;;;;45.00;;;;;;;90.00;;"Stationnaire, Immobile";;;;;;;;;;;0;;;;;;;;;;;;;;;;;;;;;;;;1;"Un seul";;;;;"Observation en continu";;
9;1954-08-08234;43;0;2012.04.19;1954.08.01;"MERS-EL-KEBIR (DZ.31) --.08.1954";;;"Temoignage recent d'une observation ancienne pres d'Oran, en Algerie, franeaise e cette date. Le temoin et plusieurs membres de sa famille voient tomber, depuis le ciel vers la mer, un disque lumineux, orange, qui stoppe e quelques metres au-dessus des flots.  Il reste immobile puis repart e 45e vers la droite et le haut du ciel.";;;T;;;H;"GARDE (LA)";83130;83;FR;;"7. Retraites";;;;;;;;;;;;;;;;;;;;O;8004;;;1954311489;;1504;;39;1;;1;;;;1954;08;??;"1954-08-15 20:00:00";"20H00 environ";;;;1296900;;;"2 min environ";;;SAINTE-CLOTILDE;;;;;;;;;Ciel;35.7;-0.7;10.0;"sur une terrasse d'une villa au bord de la mer";;;;;;;;;;;;8;;;;;;;;;;"bras et main tendu vers l'horizon, le diametre egal celui d'une balle de ping pong ou de golf";;;;"Emotion - Curiosite, Interet - Passif";;;;;;;"Soleil ou Nuit claire";;;;;disque;;"disque orange";;"Objet unique";;;;"Intensite - Tres forte, brillante, ex: projecteur puissant (mag. -20 e -15)";;;;;;;;;;;;;;;;0.0;;;;;;;;;;;;;;;;;;;;;;;;;;;;;;;;;;;;;;;;;;;;;;;;;;;;;;;;;;;0.0;;;;;;;;;;;;;;;;;;;;;;;;;;;;;;;;;;;;;;;;;;;;;;;;;;1;"Un seul";;;;;;;
10;1954-09-00007;56;0;;1954.09.13;"TANGER (MA.01) 05.09.1954";;;"observation dans le ciel d'une tache sombre qui amorce un pique vers l'Ouest e tres grande vitesse, fait un palier, remonte en chandelle e son altitude de depart s'arrete pour repartir apres 1 e 2 minutes en ligne droite . l'engin fait de nombreuses evolutions dans le ciel. absence de trainee de condensation, de bruit de lueur";1;1;T;;;H;;;;;;"51. Employes de la fonction publique";;;;;;;;;;;;;;;;;;;;O;5824;;1;1954309668;54800495;;;52;1;;1;;;;1954;09;05;"1954-09-05 17:15:00";17:15;;;17:15:00;0;;;10m;;;TANGER;;MA.01;FR;;;;;;Ciel;;;0.0;"Maroc, Cap Spartel, e proximite immediate du poste hertzien des PTT";"Territoires artificialises - Zones industrielles ou commerciales et reseaux de communication - Reseaux routier et ferroviaire et espaces associes";;;;;;""" e l'aplomb du parallele passant par le pont international et e une quinzaine de kms e l'Ouest de ce pont""";;"altitude de 8000 metres";;;-3492;;180.00;" "" e l'aplomb du parallele passant par le pont international et e une quinzaine de kms e l'Ouest de ce pont""";"Stationnaire, Immobile";;;;;"Variable (acceleration, deceleration, etc.) (valeur conservee pour compatibilite: utiliser la nature de la trajectoire)";"""grand disque""""engin ayant approximativement les dimensions d'un avion""";;;;"Emotion - Curiosite, Interet - Actif";1;;;;;;Inconnu;;;;;disque;"3D - 2 axes de symetrie - Spherique, Boule";"tache, point noir, engin";" Termes descriptifs (lumieres, forme, etc.)";"Objet unique";;Noir;;Inconnue;;;"Aucun, Silence total";;;;;;;;;;;;;0.0;;;;;;;;;;;;;90.00;;"Chg direction, niveau de vol";;;;;;;;;;;;;;;;;;;;;;;;;;;;;;;;;;;;;;;;;;;;0.0;;;;;;;"disparition e l'horizon";;;;;;270.00;;Descendante;"disparition dans la brume de l'horizon";;;;;;;;;;0;"""disparition du phenomene dans la brume de l'horizon""";;;;;;;;;;;;;;;;;;;;;;;1;"Un seul";;;;;"Observation en continu";;
11;1954-09-00008;44;0;;1954.09.01;"[CD47] de HARPONVILLE (80) vers CONTAY (80) 07.09.1954 T1";;CD47;;1;1;T;1;"20 - 29 ans";H;;;;;;"61. Ouvriers qualifies";;;;;;;;;;;;;;;;;;;;O;5772;;1;1954309647;54300293B;;;40;1;;2;;;;1954;09;07;"1954-09-07 07:15:00";07:00/07:30;;;07:15:00;900;;;5m;;;HARPONVILLE;80560;80;FR;CONTAY;80560;80;FR;"champ puis ciel";Autre;50;2.5;0.2;D47;"Territoires artificialises - Zones industrielles ou commerciales et reseaux de communication - Reseaux routier et ferroviaire et espaces associes";;;;;315.00;"dans un champ e 200m de la route e droite en venant de HARPONVILLE";;;"150 metres dans le champ puis e 100m";"<100m (proche)";65;;90.00;;"Stationnaire, Immobile";;;;;"Nulle, Immobile, Stationnaire";"diametre de 10 metres , hauteur de 3 metres";;;;"Emotion - Curiosite, Interet - Actif";1;;;;;;"Soleil ou Nuit claire";;;;;;"3D - 1 axe de symetrie - Cylindrique";;" Objet";"Objet unique";;;;Inconnue;;;"Aucun, Silence total";;;;;;;;;;;;;0.0;;;;;;;;;;;"<100m (proche)";;;;Montante;;;;;"Variable (acceleration, deceleration, etc.) (valeur conservee pour compatibilite: utiliser la nature de la trajectoire)";;;;;;;;;" Engin";;;;;;;;;;;;;;;;;;;;;;;;;;Ciel;50;;2;0.0;;;;;;225.00;;;;;;;0.00;;Montante;;;;;;;;;;;0;;;;;;;;;;;;;"Aucun, Silence total";;;;;;;;;;;1;"Un seul";;;;;"Observation en continu";;
11;1954-09-00008;45;0;;1954.09.02;"[CD47] de HARPONVILLE (80) vers CONTAY (80) 07.09.1954 T2";;CD47;;1;2;T;2;"20 - 29 ans";H;;;;;;"61. Ouvriers qualifies";;;;;;;;;;;;;;;;;;;;O;5773;;2;1954309647;54300293;;;41;1;;2;;;;1954;09;07;"1954-09-07 07:15:00";07:00/07:30;;;07:00:00;900;;;5m;;;HARPONVILLE;80560;80;FR;CONTAY;80560;80;FR;champ;Autre;50;2.5;2.0;"D47 commune de Harponville (80)";"Territoires artificialises - Zones industrielles ou commerciales et reseaux de communication - Reseaux routier et ferroviaire et espaces associes";;;;;315.00;;;;"150 metres";"<100m (proche)";72;;315.00;;"Stationnaire, Immobile";;;;;"Nulle, Immobile, Stationnaire";"10 metres de diametre sur 3 metres de hauteur";;;;"Emotion - Curiosite, Interet - Actif";1;;;;;;"Soleil ou Nuit claire";;;;;;"3D - 1 axe de symetrie - Cylindrique";;" Objet";"Objet unique";;Noir;;Inconnue;;;"Aucun, Silence total";;;;;;;;;;;;;0.0;;;;;;;;;;;;;;;Montante;;;;;;;;;;;;;;" Engin";;;;;;;;;;;;;;;;;;;;;;;;;;Ciel;50;;2;0.0;;;;;;;;;;;;;0.00;;Montante;;;;;Rapide;;;;;;0;;;;;;;;;;;;;"Aucun, Silence total";;;;;;;;;;;1;"Un seul";;;;;"Observation en continu";;
13;1954-09-00010;46;0;;1954.09.03;"FIGEAC (46) 27.09.1954 T1";;;"le Temoin se rendant e l'Ecole Communale de CEINT-D'EAU par le C.D. 13 et alors qu'elle se trouvait e quelques centaines de metres de son habitation (1 Km e l'Est de CEINT-D'EAU) a croise un homme de taille de 1m20 e 1m30, nu-tete, vetu d'une combinaison rouge, portant un fusil, qui longeait le fosse et a tire un coup de feu. Au milieu d'un pre bordant la route, la jeune fille a dit avoir remarque une sorte de caisse (cube 1 m de cote environ, sans plus de precision); puis effrayee par le coup de feu, elle s'est enfuie avec ses camarades.
 Vers midi en revenant de l ' Ecole et repassant au meme endroit, elle a vu le meme individu re joindre sa caisse et ""s'envoler"" ~ une grande vitesse. Elle n'a pu donner une description de l'envol e
";;1;T;1;"10 - 19 ans";F;;;;;;"82. Inactifs divers (autres que retraites)";;;;;;;;;;;;;;;;;;;;O;5774;;1;1954309648;RO1954001;;;42;1;;1;;;;1954;09;27;"1954-09-27 08:40:00";08:40;;;08:40:00;0;;;;;Inconnu;FIGEAC;46100;46;;;;;;campagne;"Paysage Rural";44.6;2;0.0;"C.D 13 e 1km e l'Est de CEINT-D'EAU";"Territoires agricoles";;;;;;"NON PRECISE";;;;;202;;90.00;;Inconnu;;;;;Inconnu;"1,20 e 1,30 metres";;;;"Emotion - Curiosite, Interet - Actif";1;;;;;;Inconnu;;;;;humain;"Autre forme non categorisee";"homme de petite taille 1,20 e 1,30 nu tete en combinaison rouge avec un fusil, a tire un coup de feu , caisse volante cubique de 1m de cote";Autre;"Objet unique";;;;Inconnue;;"un seul coup de feu";"Type - Technologique - Explosion, Detonation, Bang";;;;;;;;;;;;;0.0;;;;;;;;;;;;;;;;;;;;;;;;;"Action - Fuite";;;;;;;;;;;;;;;;;;;;;;;;;;;;;;;;;;0.0;;;;;;;;;;;;;0.00;;Inconnu;;;;;;;;;;;1;"fuite des enfants";;;;;;;;;;;;;;;;;;;;;;;1;"Un seul";;;;;"Observation en continu";;
13;1954-09-00010;47;0;;1954.09.04;"FIGEAC (46) 27.09.1954 T2";;;"Le temoin se rendant e l'Ecole, a remarque, au lieu designe par sa camarade T1 un individu haut de 0m50 (!) environ, portant e la main une petite caisse de 30 e 40 cm (!) de cete, a tire un coup de fusil (la fillette a ajoute: ""J'ai vu le plomb derriere""...) puis est reparti dans a caisse en s'envolant vite. ....

N'a rien vu e midi.
";;2;T;2;;F;;;;;;"82. Inactifs divers (autres que retraites)";;;;;;;;;;;;;;;;;;;;O;5775;;2;1954309648;RO1954001;;;43;1;;1;;;;1954;09;27;"1954-09-27 08:40:00";08:40;;;08:40:00;0;;;;;Inconnu;FIGEAC;46100;46;;;;;;champs;"Paysage Rural";44.6;2;0.0;"RD 13";"Territoires agricoles";;;;;;"NON PRECISE";;;;;202;;0.00;;Inconnu;;;;;Inconnu;"0,50 metre";;;;"Emotion - Curiosite, Interet - Actif";1;;;;;;Inconnu;;;;;humain;"Autre forme non categorisee";"homme de petite taille caisse volante";Autre;"Objet unique";;;;Inconnue;;"un coup de feu";"Type - Technologique - Explosion, Detonation, Bang";;;;;;;;;;;;;0.0;;;;;;;;;;;;;;;;;;;;;;;;;;;;;;;;;;;;;;;;;;;;;;;;;;;;;;;Ciel;44;;2;0.0;;;;;;;;;;;;;0.00;;Inconnu;;;;;;;;;;;1;"fuite du temoin";;;;;;;;;;;;;;;;;;;;;;;1;"Un seul";;;;;"Observation en continu";;
13;1954-09-00010;52;0;;1954.09.09;"FIGEAC (46) 27.09.1954 T3";;;"Temoin indirect, accompagnait les deux autres enfants, mais n'a rien vu";;3;T;3;"0 - 9 ans";H;;;;;;"82. Inactifs divers (autres que retraites)";;;;;;;;;;;;;;;;;;;;O;5819;;5;1954309648;RO1954001;;;48;1;;1;;;;1954;09;27;"1954-09-27 08:30:00";08:30;;;08:30:00;0;;;;;Inconnu;FIGEAC;46100;46;FR;;;;;;Inconnu;44.6;2;0.0;;"Territoires artificialises - Zones urbanisees";;;;;;;;;;"<50m (tres proche)";202;;135.00;;Montante;;;;;Rapide;"boite grande comme trois tables d'ecole";;;;Inconnu;1;;;;;;Inconnu;;;;;;"2D - Rectangulaire";;" Engin";;;;;Inconnue;;;Inconnu;;;;;;;;;Ciel;;;;0.0;;;;;;;;;;;;;;;;;;;;;;;;;;;;;;;;;;;;;;;;;;;;;;;;;;;;;;;;;;;0.0;;;;;;;;;;;;;;;;;;;;;;;;;;0;;;;;;;;;;;;;;;;;;;;;;;;1;"Un seul";;;;;"Observation en continu";;
17;1954-10-00014;83;0;;1954.10.21;"CREPY-EN-VALOIS (60) 06.10.1954";;;"fiche de renseignement rapportant par un PV l'observation durant 40 min d'un disque lumineux de couleur rouge orange d'un diametre apparent de la moitie de la pleine lune supportant une espece de nacelle . intensite lumineuse variable deplacement lent vers la droite par rapport au point d'observation";;1;T;;;H;;;;;;"7. Retraites";;;;;;;;;;;;;;;;;;;;O;5825;;1;1954309669;54700414;;;74;1;;1;;;;1954;10;06;"1954-10-06 20:00:00";20:00;;;20:00:00;0;;;40m;;;CREPY-EN-VALOIS;60800;60;FR;;;;;;Ciel;49.2;2.9;0.0;;Inconnu;;;;;;"NON PRECISE";;;;;93;;0.00;;Inconnu;;;;;Lente;"diametre de la moitie de la lune";;;;"Emotion - Curiosite, Interet - Actif";1;;;;;;Inconnu;;;;;disque;"Autre forme non categorisee";;" Objet";"Objet unique";;Rouge;;"Intensite - Forte ou lumineux, ex: ampoule (mag. -15 e -10)";;;Inconnu;;;;;;;;;;;;;0.0;;;;;;;;;;;;;;;;;;;;;;;;;;;;;;;;"Orange, feu";;;;;;;;;;;;;;;;;;;;;;;;;;;0.0;;;;;;;;;;;;;;;;;;;;;;;;;;0;;;;;;;;;;;;;;;;;;;;;;;;1;"Un seul";;;;;"Observation en continu";;
18;1954-10-00015;76;0;;1954.10.14;"LACROIX-SAINT-OUEN (60) 07.10.1954";;;"fiche de renseignement indiquant l'observation e 9h par deux personnes d'un engin e la verticale du clocher de LA CROIX ST OUEN . direction de marche SE-NE e une altitude de 400m env. engin de forme ovale couleur aluminium tres brillant .
aucune coordonnees temoins";;1;T;;;H;;;;;;;;;;;;;;;;;;;;;;;;;;O;5784;;1;1954309656;54700457;;;67;1;;1;;;;1954;10;07;"1954-10-07 09:00:00";09:00;;;09:00:00;0;;;1m;;;LACROIX-SAINT-OUEN;60610;60;FR;;;;;;Ciel;49.4;2.8;0.0;;"Territoires agricoles";;;;;135.00;;;"altitude de 400 metres";;;;;45.00;;Inconnu;;;;;Inconnu;;;;;"Emotion - Curiosite, Interet - Actif";1;;;;;;Inconnu;;;;;;"3D - 2 axes de symetrie - Ovoede";;" Engin";"Objet unique";;;;"Intensite - Forte ou lumineux, ex: ampoule (mag. -15 e -10)";;;Inconnu;;;;;;;;;;;;;0.0;;;;;;;;;;;;;;;;;;;;;;;;;;;;;;;;;;;;;;;;;;;;;;;;;;;;;;;;;;;0.0;;;;;;;;;;;;;;;;;;;;;;;;;;0;;;;;;;;;;;;;;;;;;;;;;;;1;"Un seul";;;;;"Observation en continu";;
19;1954-10-00016;77;0;;1954.10.15;"LACROIX-SAINT-OUEN (60) 08.10.1954";;;"Observation par 4 personnes d'un engin apereu e la verticale du centre electrique de LA CROIX ST OUEN , direction de marche EST-OUEST. engin en forme de cercle lumineux";;1;T;;;H;;;;;;;;;;;;;;;;;;;;;;;;;;O;5785;;1;1954309657;54700458;;;68;1;;1;;;;1954;10;08;"1954-10-08 23:30:00";23:30;;;23:30:00;0;;;1m;;;LACROIX-SAINT-OUEN;60610;60;FR;;;;;;Ciel;49.4;2.8;0.0;;"Territoires agricoles";;;;;90.00;;;;;;;;270.00;;Inconnu;;;;;Inconnu;;;;;"Emotion - Curiosite, Interet - Actif";1;;;;;;Inconnu;;;;;;"3D - 2 axes de symetrie - Spherique, Boule";;" Engin";"Objet unique";;;;"Intensite - Forte ou lumineux, ex: ampoule (mag. -15 e -10)";;;Inconnu;;;;;;;;;;;;;0.0;;;;;;;;;;;;;;;;;;;;;;;;;;;;;;;;;;;;;;;;;;;;;;;;;;;;;;;;;;;0.0;;;;;;;;;;;;;;;;;;;;;;;;;;0;;;;;;;;;;;;;;;;;;;;;;;;1;"Un seul";;;;;"Observation en continu";;
20;1954-10-00017;74;0;;1954.10.12;"CROTOY (LE) (80) 09.10.1954";;;"fiche de renseignement indiquant l'observation vers 20h par 3 agriculteurs du CROTOY e une distance indeterminee dans le ciel d'un disque orange ayant la forme d'une assiette retournee qui a evolue durant 45 min avant de disparaitre direction NO.
aucune identite donnee sur les temoins";;;T;;;H;;;;;;"69. Ouvriers agricoles";;;;;;;;;;;;;;;;;;;;O;5782;;;1954309654;54700462;;;65;1;;1;;;;1954;10;09;"1954-10-09 20:00:00";20:00;;;20:30:00;0;;;;00:45;;"CROTOY (LE)";80550;80;FR;;;;;;Ciel;50.2;1.6;0.0;;"Territoires agricoles";;;;;;"NON PRECISE";;;;;;;315.00;;Inconnu;;;;;Inconnu;;;;;"Emotion - Curiosite, Interet - Actif";1;;;;;;Inconnu;;;;;assiette;"Autre forme non categorisee";;;"Objet unique";;"Orange, feu";;Inconnue;;;Inconnu;;;;;;;;;;;;;0.0;;;;;;;;;;;;;;;;;;;;;;;;;;;;;;;;;;;;;;;;;;;;;;;;;;;;;;;;;;;0.0;;;;;;;;;;;;;;;;;;;;;;;;;;0;;;;;;;;;;;;;;;;;;;;;;;;1;"Un seul";;;;;"Observation en continu";;
21;1954-10-09218;113;0;;1954.10.51;"HEM-HARDINVAL (80) 14.10.1954";;;"fiche succincte de renseignement : Observation par 4 temoins d'un appareil spherique ne faisant aucun bruit au couleur de l'arc en ciel et se deplaeant en direction du SO e tres grande vitesse e hauteur 40m  ";;1;T;;;H;;;;;;;;;;;;;;;;;;;;;;;;;;O;5983;;1;1954309797;;;;101;1;;1;;[GEND];;1954;10;14;"1954-10-14 17:00:00";17:00;;;01:40:00;0;;;2m;;Inconnu;HEM-HARDINVAL;80600;80;FR;;;;;;Inconnu;50.2;2.3;0.0;RN25;"Territoires agricoles";;;;;225.00;;;;;;;;;SUD-OUEST;Inconnu;;;;;"Tres rapide";;;;;"Emotion - Curiosite, Interet - Actif";1;;;;;;Inconnu;;;;;spherique;"3D - 2 axes de symetrie - Spherique, Boule";appareil;" Objet";"Objet unique";;Multicolore;;Inconnue;;;"Aucun, Silence total";;;;;;;;;;;;;0.0;;;;;;;;;;;;;;;;;;;;;;;;;;;;;" Phenomene";;;;;;;;;;;;;;;;;;;;;;;;;;;;;;0.0;;;;;;;;;;;;;;;;;;;;;;;;;;0;;;;;;;;;;;;;;;;;;;;;;;;1;"Un seul";;;;;"Observation en continu";;
27;1954-10-00024;68;0;;1954.10.06;"[C244] de ANDRES (62) vers GUINES (62) 21.10.1954 T1";;C244;;;1;T;1;;H;;;;;;"32. Cadres de la fonction publique, professions intellectuelles et  artistiques";;;;;;;;;;;;;;;;;;;;O;5776;;1;1954309809;54700412;;;59;1;;2;;[C244];;1954;10;21;"1954-10-21 19:30:00";19:30;;;19:30:00;0;;;15s;;;ANDRES;62340;62;;GUINES;62340;62;;;Ciel;50.9;1.9;0.0;;"Territoires artificialises - Zones industrielles ou commerciales et reseaux de communication - Reseaux routier et ferroviaire et espaces associes";;;;;0.00;;;;;;;;180.00;;Inconnu;;;;;Rapide;;;;;"Emotion - Curiosite, Interet - Actif";1;;;;;;"Soleil ou Nuit claire";;;;;;;;" Phenomene";"Traenee, Queue ; Objet unique";;;;"Intensite - Forte ou lumineux, ex: ampoule (mag. -15 e -10)";;;"Aucun, Silence total";;;;;;;;;;;;;0.0;;;;;;;;;;;;;;;;;;;;;;;;;;;;;;;;;;;;;;;;;;;;;;;;;GUINES;62340;62;;;;;;;;0.0;;;;;;;;;;;;;;;;;;;;;;;;;;0;;;;;;;;;;;;;;;;;;;;;;;;1;"Un seul";;;;;"Observation en continu";;
27;1954-10-00024;116;0;;1954.10.54;"[C244] de ANDRES (62) vers GUINES (62) 21.10.1954 T2";;[C244];;;2;T;2;;H;;;;;;"51. Employes de la fonction publique";;;;;;;;;;;;;;;;;;;;O;5994;;2;1954309809;54700412;;;103;1;;2;;[C244];;1954;10;21;"1954-10-21 19:30:00";19:30;;;19:30:00;0;;;15s;;;ANDRES;62340;62;;;;;;;Ciel;50.9;1.9;0.0;;"Territoires agricoles";;;;;0.00;;;"altitude de 400 e 500 metres";;;;;135.00;;"Lineaire ou Rectiligne";;;;;Rapide;;;;;"Emotion - Curiosite, Interet - Actif";1;;;;;;"Soleil ou Nuit claire";;;;;conique;;"trainee lumineuse";" Phenomene";"Traenee, Queue ; Objet unique";;;;"Intensite - Forte ou lumineux, ex: ampoule (mag. -15 e -10)";;;"Aucun, Silence total";;;;;;;;;;;;;0.0;;;;;;;;;;;;;;;;;;;;;;;;;;;;;;;;;;;;;;;;;;;;;;;;;;;;;;;;;;;0.0;;;;;;;;;;;;;;;;;;;;;;;;;;0;;;;;;;;;;;;;;;;;;;;;;;;1;"Un seul";;;;;"Observation en continu";;
28;1954-10-09243;87;0;;1954.10.25;"MAILLY-LE-CAMP (10) 27.10.1954";;;"Au coucher du soleil le temoin (colonel) observe legerement au nord par rapport au soleil couchant un segment de metal brillant avec un deplacement particulier  (voir schema sur MOC). duree obs 10 e 15 secondes immobile puis 25 e30 secondes en deplacement . hauteur angulaire 45e e 20e ";;1;T;;;H;;;;;;"32. Cadres de la fonction publique, professions intellectuelles et  artistiques";;;;;;;;;;;;;;;;;;;;O;5829;;1;1954309673;54700413;;;77;1;;1;;;;1954;10;27;"1954-10-27 17:45:00";17:45;;;17:45:00;0;;;;non;"quelques dizaines de secondes";MAILLY-LE-CAMP;10230;10;FR;;;;;;Ciel;48.7;4.2;0.0;"camp militaire";"Territoires agricoles";;;;;0.00;"legerement au nord par rapport au soleil couchant";;"45 e 20 degres au dessus de l'horizon";NP;;128;;0.00;;"Stationnaire, Immobile";;;;;Inconnu;NP;;;;"Emotion - Curiosite, Interet - Actif";1;;Direct;;NP;NP;Inconnu;"ciel pur au couchant ";;"coucher du soleil";;"segment rectangulaire";;"segment brillant";" Objet";"Objet unique";"metal brillant";;lumineux;"Intensite - Forte ou lumineux, ex: ampoule (mag. -15 e -10)";NP;NP;Inconnu;;;;;;;;;;;;;0.0;;;;;;;;;;;;;;;;;;;;;;;;;;;;;" Phenomene";;;;;;;;;;;;;;;;;;;;;;;;;;;;;;0.0;;;;;;;NP;;NP;;;;;;;;;;;;;;;;;0;NP;;;;;;;;;;;;;;;;;;;;;;NP;1;"Un seul";;;;;"Non precise";;NP
29;1954-10-00026;78;0;;1954.10.16;"LONG (80) 31.10.1954 T1";;;;;1;T;1;"20 - 29 ans";H;;;;;;"69. Ouvriers agricoles";;;;;;;;;;;;;;;;;;;;O;5786;;1;1954309658;54700431A;;;69;1;;1;;;;1954;10;31;"1954-10-31 20:00:00";20:00;;;20:00:00;0;;;;;Inconnu;LONG;80510;80;FR;;;;;;"Paysage Rural";50;2;0.0;"lieu dit "" le Corrompu"" territoire de Long";"Territoires agricoles";;;;;;"lieu dit le Corrompu territoire de LONG";;"quelques metres du sol";;;45;;0.00;;Inconnu;tournoye;;;;Inconnu;"diametre d'une table ronde ordinaire";;;;"Emotion - Curiosite, Interet - Actif";1;;;;;;Inconnu;;;;;;;"engin lumineux";" Engin";"Objet unique";;;;"Intensite - Forte ou lumineux, ex: ampoule (mag. -15 e -10)";;;Inconnu;;;;;;;;;;;;;0.0;;;;;;;;;;;;;;;;;;;;;;;;;;;;;;;;;;;;;;;;;;;;;;;;;;;;;;;;;;;0.0;;;;;;;;;;;;;;;;;;;;;;;;;;1;;;;;;;;;;;;;;;;;;;;;;;;1;"Un seul";;;;;"Observation en continu";;
29;1954-10-00026;79;0;;1954.10.17;"LONG (80) 31.10.1954 T2";;;;;2;T;2;"30 - 39 ans";H;;;;;;"69. Ouvriers agricoles";;;;;;;;;;;;;;;;;;;;O;5787;;2;1954309658;54700431;;;70;1;;1;;;;1954;10;31;"1954-10-31 19:45:00";19:45;;;19:45:00;0;;;;;Inconnu;LONG;80510;80;;;;;;;"Paysage Rural";50;2;0.0;;"Territoires agricoles";;;;;;"lieu dit ""le Corrompu"" territoire de Long";;"4 metres du sol";"30 metres";"<50m (tres proche)";45;;180.00;;"Chg direction, niveau de vol";"tournoye puis s'eleve";;;;Inconnu;;;;;"Emotion - Curiosite, Interet - Actif";1;;;;;;Inconnu;;;;;;"3D - 2 axes de symetrie - Spherique, Boule";"boule de feu";" Engin";"Objet unique";;"Orange, feu";;"Intensite - Forte ou lumineux, ex: ampoule (mag. -15 e -10)";;;Inconnu;;;;;;;;;;;;;0.0;;;;;;;;;;;;;;;;;;;;;;;;;;;;;;;;;;;;;;;;;;;;;;;;;;;;;;;;;;;0.0;;;;;;;;;;;;;;;;;;;;;;;;;;0;;;;;;;;;;;;;;;;;;;;;;;;1;"Un seul";;;;;"Observation en continu";;
29;1954-10-00026;80;0;;1954.10.18;"LONG (80) 31.10.1954 T3";;;;;3;T;3;;H;;;;;;"22. Commereants et assimiles";;;;;;;;;;;;;;;;;;;;O;5788;;3;1954309658;54700431B;;;71;1;;1;;;;1954;10;31;"1954-10-31 20:00:00";20:00;;;20:00:00;0;;;;;Inconnu;LONG;80510;80;;;;;;;Ciel;50;2;0.0;"pas de sa porte";"Territoires artificialises - Zones urbanisees";;;;;;"arbres bordant la Somme";;;;;45;;;;Inconnu;;;;;Rapide;"diametre de 1 metre";;;;"Emotion - Curiosite, Interet - Actif";1;;;;;;Inconnu;;;;;;"3D - 2 axes de symetrie - Spherique, Boule";"boule illuminee";" Phenomene";"Objet unique";;Multicolore;;"Intensite - Forte ou lumineux, ex: ampoule (mag. -15 e -10)";;;Inconnu;;;;;;;;;;;;;0.0;;;;;;;;;;;;;;;;;;;;;;;;;;;;;;;;;;;;;;;;;;;;;;;;;;;;;;;;;;;0.0;;;;;;;;;;;;;;;;;;;;;;;;;;0;;;;;;;;;;;;;;;;;;;;;;;;1;"Un seul";;;;;"Observation en continu";;
29;1954-10-00026;81;0;;1954.10.19;"LONG (80) 31.10.1954 T4";;;;;4;T;4;;H;;;;;;"22. Commereants et assimiles";;;;;;;;;;;;;;;;;;;;O;5789;;4;1954309658;54700431C;;;72;1;;1;;;;1954;10;31;"1954-10-31 20:00:00";20:00;;;20:00:00;0;;;;;Inconnu;LONG;80510;80;;;;;;;Ciel;50;2;0.0;CD112;"Territoires artificialises - Zones industrielles ou commerciales et reseaux de communication - Reseaux routier et ferroviaire et espaces associes";;;;;;"la vallee de la riviere La Somme";;;;;45;;180.00;;Inconnu;;;;;Inconnu;;;;;"Emotion - Curiosite, Interet - Actif";1;;;;;;Inconnu;;;;;"cylindrique puis allongee voir ovale";"3D - 1 axe de symetrie - Cylindrique";;" Engin";"Objet unique";;;;Inconnue;;;Inconnu;;;;;;;;;;;;;0.0;;;;;;;;;;;;;;;;;;;;;;;;;;;"3D - 2 axes de symetrie - Ovoede";;;;;;;;;;;;;;;;;;;;;;;;;;;;;;;;0.0;;;;;;;;;;;;;;;;;;;;;;;;;;0;;;;;;;;;;;;;;;;;;;;;;;;1;"Un seul";;;;;"Observation en continu";;
43;1954-11-00030;164;0;;1954.11.26;"TEMARA (MA.01) 20.11.1954";;;;;1;T;;;H;;;;;;"41. Professions intermediaires de l'enseignement, de la sante, de la fonction publique et assimiles";;;;;;;;;;;;;;;;;;;;O;5991;;1;1954309695;54800434;;;145;1;;1;;;;1954;11;20;"1954-11-20 00:30:00";00:30-03:30;;;00:30:00;0;;;3h;;;TEMARA;10000;01;MA;;;;;;Ciel;;;0.0;;"Territoires artificialises - Zones urbanisees";;;;;;temara;;"altitude de 1500 metres";;;;;180.00;;Autre;"verticlament et en zig-zag";;;;Inconnu;"entre lune et etoile";;;;"Emotion - Curiosite, Interet - Actif";1;;;;;;"Soleil ou Nuit claire";;;;;"demi circulaire";"Autre forme non categorisee";;" Objet";;;Noir;"tantet brillant tantet sombre entoure d'un halo";"Intensite - Forte ou lumineux, ex: ampoule (mag. -15 e -10)";;;"Aucun, Silence total";;;;;;;;;;;;;0.0;;;;;;;;;;;;;;;;;;;;;;;;;;;;;;"Halo(s) lumineux";;;;;;;;;;;;;;;;;;;;;;;;;;;;;0.0;;;;;;;;;;;;;;;;;;;;;;;;;;0;;;;;;;;;;;;;;;;;;;;;;;;1;"Un seul";;;;;"Observation en continu";;
46;1955-01-00033;185;0;;1955.01.03;"CUGNY (02) 19.01.1955 T3";;;;;3;T;3;"10 - 19 ans";H;;;;;;"82. Inactifs divers (autres que retraites)";;;;;;;;;;;;;;;;;;;;O;5762;;3;1955309642;55700448;;;159;1;;1;;;;1955;01;19;"1955-01-19 22:00:00";22:00;;;22:00:00;0;;;;;;CUGNY;2480;02;;;;;;;Ciel;49.7;3.2;0.0;;"Territoires artificialises - Zones industrielles ou commerciales et reseaux de communication - Reseaux routier et ferroviaire et espaces associes";;;;;;Saint-Simon;;;;;;;180.00;" Saint-Quentin";Montante;;;;;Rapide;20cm;;;;"Emotion - Curiosite, Interet - Actif";1;;;;;;Inconnu;;;;;disque;"3D - 2 axes de symetrie - Spherique, Boule";"avec faisceau orange";" Engin";;;Blanc;;"Intensite - Forte ou lumineux, ex: ampoule (mag. -15 e -10)";;;"Aucun, Silence total";;;;;;;;;;;;;0.0;;;;;;;;;;;;;;;;;;;;;;;;;;;;;;"Traenee, Queue";;;;;;;;;;;;;;;;;;;;;;;;;;;;;0.0;;;;;;;Saint-Simon;;;;;;180.00;" Cugny";Montante;;;;;;;;;;;0;;;;;;"Traenee, Queue";;;;;;;;;;;;;;;;;;1;"Un seul";;;;;"Observation en continu";;
46;1955-01-00033;183;0;;1955.01.01;"SAINT-SIMON (02) 19.01.1955 T1";;;;;1;T;1;;H;;;;;;"21. Artisans";;;;;;;;;;;;;;;;;;;;O;5760;;1;1955309642;55700448A;;;157;1;;1;;;;1955;01;19;"1955-01-19 22:10:00";22:10;;;22:10:00;0;;;5s;;;SAINT-SIMON;2640;02;;;;;;;Ciel;49.7;3.2;0.0;;"Territoires artificialises - Zones industrielles ou commerciales et reseaux de communication - Reseaux routier et ferroviaire et espaces associes";;;;;;Saint-Simon;;"300 metres d'altitude";;;;;180.00;" saint Quentin";Montante;;;;;Rapide;"diametre de 20 e 30 cm";;;;"Emotion - Curiosite, Interet - Actif";1;;;;;;Inconnu;;;;;disque;"Autre forme non categorisee";"queue de 20 m de long";" Engin";"Objet unique";;"Orange, feu";;"Intensite - Forte ou lumineux, ex: ampoule (mag. -15 e -10)";;;"Aucun, Silence total";;;;;;;;;;;;;0.0;;;;;;;;;;;;;;;;;;;;;;;;;;;;;;;;;;;;;;;;;;;;;;;;;;;;;;;;;;;0.0;;;;;;;Saint-Simon;;;;;;180.00;" Cugny";Montante;;;;;;;;;;;0;;;;;;;;;;;;;;;;;;;;;;;;1;"Un seul";;;;;"Observation en continu";;
46;1955-01-00033;184;0;;1955.01.02;"SAINT-SIMON (02) 19.01.1955 T2";;;;;2;T;2;;F;;;;;;"82. Inactifs divers (autres que retraites)";;;;;;;;;;;;;;;;;;;;O;5761;;2;1955309642;55700448;;;158;1;;1;;;;1955;01;19;"1955-01-19 22:00:00";22:00;;;22:00:00;0;;;;;;SAINT-SIMON;2640;02;;;;;;;Ciel;49.7;3.2;0.0;;"Territoires artificialises - Zones industrielles ou commerciales et reseaux de communication - Reseaux routier et ferroviaire et espaces associes";;;;;;Saint-Simon;;;;;;;180.00;" Saint-Quentin";Montante;;;;;Rapide;petit;"0.04 < x < 0.1e ou ""Tres petite/Minuscule""";;;"Emotion - Curiosite, Interet - Actif";1;;;;;;Inconnu;;;;;disque;"Autre forme non categorisee";"ensemble lumineux";" Termes descriptifs (lumieres, forme, etc.)";"Traenee, Queue ; Objet unique";;"Orange, feu";;"Intensite - Forte ou lumineux, ex: ampoule (mag. -15 e -10)";;;"Aucun, Silence total";;;;;;;;;;;;;0.0;;;;;;;;;;;;;;;;;;;;;;;;;;;;;;;;Blanc;;;;;;;;;;;;;;;;;;;;;;;;;;;0.0;;;;;;;Saint-Simon;;;;;;180.00;" Cugny";Montante;;;;;;;;;;;0;;;;;;;;;;;;;;;;;;;;;;;;1;"Un seul";;;;;"Observation en continu";;
47;1955-01-01950;182;0;2009.01.16;1955.00.01;"REMIREMONT (88) --.--.1955";;;"3 observations anciennes 1955 - 1960 - 1975";;;T;;;H;VILLELONGUE-DELS-MONTS;66740;66;FR;;;;;;;;;;;;;;;;;;;;;;O;;;;1955311490;;540;;156;1;;1;;;;1955;--;--;"1955-06-15 12:00:00";;;;;16891200;;;;;;REMIREMONT;88200;88;FR;;;;;;Ciel;48;6.6;2.3;;;;;;;;;;;;;399;;;;;;;;;;;;;;"Emotion - Curiosite, Interet - Passif";;;;;;;;;;;;;;;;"Objet unique";;;;;;;;;;;;;;;;;;;;0.0;;;;;;;;;;;;;;;;;;;;;;;;;;;;;;;;;;;;;;;;;;;;;;;;;;;;;;;;;;;0.0;;;;;;;;;;;;;;;;;;;;;;;;;;;;;;;;;;;;;;;;;;;;;;;;;;;;;;;;;;
48;1955-05-00034;186;0;;1955.05.01;"GIVET (08) 20.05.1955 T1";;;"observation par deux gendarmes du vol horizontal en dir du NO d'un engin de la forme d'un gros obus ou cigare de la dimension de la carlingue d'un avion de chasse. l'interieur etait lumineux de l'arriere jaillissaient des projections lumineuses et etincelantes multicolores . les gendarmes affirment qu'il ne peut s'agir d'un avion";;1;T;1;;H;;;;;;"51. Employes de la fonction publique";;;;;;;;;;;;;;;;;;;;O;5759;;1;1955309832;55700498;;"ROCROI (08) 1955";160;1;;1;;;;1955;05;20;"1955-05-20 02:30:00";02:30;;;02:30:00;0;;;;;;GIVET;8600;08;FR;;;;;;Ciel;50.1;4.8;0.0;"Nationale 51 entre Givet et le hameau des trois Fontaines";"Territoires artificialises - Zones industrielles ou commerciales et reseaux de communication - Reseaux routier et ferroviaire et espaces associes";;;;;135.00;;;"altitude de 300 e 400 metres";;;;;135.00;;"Lineaire ou Rectiligne";"vol horizontal";;;;Rapide;;"0.04 < x < 0.1e ou ""Tres petite/Minuscule""";;;"Emotion - Curiosite, Interet - Actif";1;;;;;;"Soleil ou Nuit claire";;;;;;"3D - 1 axe de symetrie - Cylindrique";"avec trainee";" Engin";"Objet unique";;;;"Intensite - Forte ou lumineux, ex: ampoule (mag. -15 e -10)";;;Inconnu;;;;;;;;;;;;;0.0;;;;;;;;;;;;;;;;;;;;;;;;;;;;;;;;;;;;;;;;;;;;;;;;;;;;;;;;50;;4;0.0;;;;;;315.00;;;;;;;270.00;;"Lineaire ou Rectiligne";"vol horizontal";;;;;;;;;;0;;;;;;;;;;;;;;;;;;;;;;;;1;"Un seul";;;;;"Observation en continu";;
48;1955-05-00034;187;0;;1955.05.02;"GIVET (08) 20.05.1955 T2";;;"observation par deux gendarmes du vol horizontal en dir du NO d'un engin de la forme d'un gros obus ou cigare de la dimension de la carlingue d'un avion de chasse. l'interieur etait lumineux de l'arriere jaillissaient des projections lumineuses et etincelantes multicolores . les gendarmes affirment qu'il ne peut s'agir d'un avion";;2;T;2;;H;;;;;;"51. Employes de la fonction publique";;;;;;;;;;;;;;;;;;;;O;6031;;2;1955309832;55700498;;"ROCROI (08) 1955";161;1;;1;;;;1955;05;20;"1955-05-20 02:30:00";02:30;;;02:30:00;0;;;;;Inconnu;GIVET;8600;08;FR;;;;;;Ciel;50.1;4.8;0.0;;"Territoires artificialises - Zones urbanisees";;;;;135.00;;;"altitude de 300 e 400 metres";;;;;315.00;;"Lineaire ou Rectiligne";;;;;Rapide;;"0.04 < x < 0.1e ou ""Tres petite/Minuscule""";;;;1;;;;;;Inconnu;;;;;;"3D - 1 axe de symetrie - Cylindrique";;" Engin";;;Multicolore;;"Intensite - Forte ou lumineux, ex: ampoule (mag. -15 e -10)";;;"Aucun, Silence total";;;;;;;;;;;;;0.0;;;;;;;;;;;;;;;;;;;;;;;;;;;;;" Objet";;;;;;;;;;;;;;;;;;;;;;;;;;;;;;0.0;;;;;;;;;;;;;;;;;;;;;;;;;;0;;;;;;;;;;;;;;;;;;;;;;;;1;"Un seul";;;;;"Observation en continu";;
49;1955-06-00035;188;0;;1955.06.01;"CAVAILLON (84) 05.06.1955";;;;;1;T;;;H;;;;;;"41. Professions intermediaires de l'enseignement, de la sante, de la fonction publique et assimiles";;;;;;;;;;;;;;;;;;;;O;5764;;1;1955309643;55700493;;;162;1;;1;;;;1955;06;05;"1955-06-05 20:55:00";20:55;;;20:55:00;0;;;20s;;;CAVAILLON;84300;84;;;;;;;Ciel;43.8;5;0.0;Cavaillon;"Territoires artificialises - Zones urbanisees";;;;;;"corne ouest du Luberon";;;;;;;180.00;" corne ouest du Luberon";Inconnu;;;;;Fulgurante;"""rectangle d'un diametre apparent de 40 milliemes""";;;;"Emotion - Curiosite, Interet - Actif";1;;;;;;Inconnu;;;;;"recta,gulaire puis en demi lune puis boule et ponctuel";"2D - Rectangulaire";"rectangle lumineux";Autre;"Objet unique";;Rouge;;"Intensite - Forte ou lumineux, ex: ampoule (mag. -15 e -10)";;;Inconnu;;;;;;;;;;;;;0.0;;;;;;;;;;;;;;;;;;;;;;;;;;;"Autre forme non categorisee";;;;;"Orange, feu";;;;;;;;;;;;;;;;;;;;;;;;43;;5;0.0;;;;;;90.00;;;;;;;;;Inconnu;;;;;;;;;;;0;;;"3D - 2 axes de symetrie - Spherique, Boule";;;;;;;;;;;;;;;;;;;;;1;"Un seul";;;;;"Observation en continu";;
50;1956-04-00036;197;0;;1956.04.09;"ELBEUF (76) 08.04.1956 T4";;;;;4;T;4;;H;;;;;;"61. Ouvriers qualifies";;;;;;;;;;;;;;;;;;;;O;6028;;4;1956309831;56700497;;;166;1;;1;;;;1956;04;08;"1956-04-08 23:37:30";23:30/23:45;;;23:37:30;450;;;;;;ELBEUF;76500;76;;;;;;;Ciel;49.3;1;0.0;;"Territoires artificialises - Zones industrielles ou commerciales et reseaux de communication - Reseaux routier et ferroviaire et espaces associes";;;;;;"au-dessus de La Londe";;;;;;;180.00;;"Lineaire ou Rectiligne";;;;;Rapide;"diametre de 60 cm";;;;"Emotion - Curiosite, Interet - Actif";1;;;;;;Inconnu;;;;;ronde;"3D - 2 axes de symetrie - Spherique, Boule";forme,engin;;"Objet unique";;Rouge;;Inconnue;;;"Aucun, Silence total";;;;;;;;;;;;;0.0;;;;;;;;;;;;;;;;;;;;;;;;;;;;;;;;;;;;;;;;;;;;;;;;;;;;;;;;;;;0.0;;;;;;;;;;;;;;;;;;;;;;;;;;0;;;;;;;;;;;;;;;;;;;;;;;;1;"Un seul";;;;;"Observation en continu";;
50;1956-04-00036;198;0;;1956.04.10;"ELBEUF (76) 08.04.1956 T5";;;;;5;T;5;;F;;;;;;"61. Ouvriers qualifies";;;;;;;;;;;;;;;;;;;;O;6029;;5;1956309831;56700497;;;167;1;;1;;;;1956;04;08;"1956-04-08 23:45:00";23:45;;;23:45:00;0;;;;;;ELBEUF;76500;76;;;;;;;Ciel;49.3;1;0.0;"au hammeau des ecamaux";"Territoires artificialises - Zones industrielles ou commerciales et reseaux de communication - Reseaux routier et ferroviaire et espaces associes";;;;;;"LA LONDE";;;;;;;0.00;;"Lineaire ou Rectiligne";;;;;Rapide;;;;;"Emotion - Curiosite, Interet - Actif";1;;;;;;Inconnu;;;;;;"3D - 2 axes de symetrie - Spherique, Boule";forme;" Objet";"Objet unique";;Rouge;;Inconnue;;;"Aucun, Silence total";;;;;;;;;;;;;0.0;;;;;;;;;;;;;;;;;;;;;;;;;;;;;;;;;;;;;;;;;;;;;;;;;;;;;;;;;;;0.0;;;;;;;;;;;;;;;;;;;;;;;;;;0;;;;;;;;;;;;;;;;;;;;;;;;1;"Un seul";;;;;"Observation en continu";;
50;1956-04-00036;199;0;;1956.04.11;"ELBEUF (76) 08.04.1956 T6";;;;;6;T;6;"50 - 59 ans";H;;;;;;"21. Artisans";;;;;;;;;;;;;;;;;;;;O;6030;;6;1956309831;56700497;;;168;1;;1;;;;1956;04;08;"1956-04-08 23:30:00";23:30;;;23:30:00;0;;;4/5s;;;ELBEUF;76500;76;;;;;;;Ciel;49.3;1;0.0;;"Territoires artificialises - Zones industrielles ou commerciales et reseaux de communication - Reseaux routier et ferroviaire et espaces associes";;;;;;"LA LONDE";;;;;;;180.00;;"Lineaire ou Rectiligne";;;;;Rapide;;;;;"Emotion - Curiosite, Interet - Actif";1;;;;;;Inconnu;;;;;;"3D - 2 axes de symetrie - Spherique, Boule";"forme,un gros phare,";;"Objet unique";;Rouge;;Inconnue;;;"Aucun, Silence total";;;;;;;;;;;;;0.0;;;;;;;;;;;;;;;;;;;;;;;;;;;;;;;;;;;;;;;;;;;;;;;;;;;;;;;;;;;0.0;;;;;;;;;;;;;;;;;;;;;;;;;;0;;;;;;;;;;;;;;;;;;;;;;;;1;"Un seul";;;;;"Observation en continu";;
50;1956-04-00036;194;0;;1956.04.06;"LONDE (LA) (76) 08.04.1956 T1";;;;;1;T;1;"10 - 19 ans";H;;;;;;"61. Ouvriers qualifies";;;;;;;;;;;;;;;;;;;;O;6025;;1;1956309831;56700497;;;163;1;;1;;;;1956;04;08;"1956-04-08 23:40:00";23:40;;;23:40:00;0;;;25m;;;"LONDE (LA)";76500;76;FR;;;;;;Ciel;49.3;1;0.0;"chemin vicinal 1au carrefour de la ""bergerie"" et du ""chene e la vierge""";"Territoires artificialises - Zones industrielles ou commerciales et reseaux de communication - Reseaux routier et ferroviaire et espaces associes";;;;;;"Saint-Ouen du Tilleul";;"altitude de 800 metres";"300 ou 400m";;;;180.00;;"Chg direction, niveau de vol";;;;;"Variable (acceleration, deceleration, etc.) (valeur conservee pour compatibilite: utiliser la nature de la trajectoire)";"8 metres de diametre";;;;"Emotion - Curiosite, Interet - Actif";1;;;;;;"Soleil ou Nuit claire";;;;;"boule puis disque avec coupole au dessus";"Autre forme non categorisee";"boule fixe rouge puis disque jaune orange en mouvement";;"Objet unique";;Rouge;viariable;Inconnue;;;"Aucun, Silence total";;;;;;;;;;;;;0.0;;;;;;;;;;;;;;;;;;;;;;;;;"Emotion - Inquietude, Anxiete, Peur";;;;" Engin";;;;;;;;;;;;;;;;;;;;;;;;;;;;;;0.0;;;;;;;;;;;;;;;;;;;;;;;;;;0;;;;;" Objet";;;;;;;;;;;;;;;;;;;1;"Un seul";;;;;"Observation en continu";;
50;1956-04-00036;196;0;;1956.04.08;"LONDE (LA) (76) 08.04.1956 T3";;;;;3;T;3;"10 - 19 ans";H;;;;;;"61. Ouvriers qualifies";;;;;;;;;;;;;;;;;;;;O;6027;;3;1956309831;56700497;;;165;1;;1;;;;1956;04;08;"1956-04-08 23:45:00";23:45;;;23:45:00;0;;;20m;;;"LONDE (LA)";76500;76;;;;;;;Ciel;49.3;1;0.0;"chemin vicinal 1";"Territoires artificialises - Zones industrielles ou commerciales et reseaux de communication - Reseaux routier et ferroviaire et espaces associes";;;;;;"au sommet de la cote de La Londe sur le VIO";;"altitude de 800 metres";;;;;180.00;;"Chg direction, niveau de vol";;;;;"Variable (acceleration, deceleration, etc.) (valeur conservee pour compatibilite: utiliser la nature de la trajectoire)";;;;;"Emotion - Curiosite, Interet - Actif";1;;;;;;"Soleil ou Nuit claire";;;;;"disque, cloche";"Autre forme non categorisee";"disque, cloche haut rouge et base blanche, soucoupe";;"Objet unique";;Rouge;;Inconnue;;;"Aucun, Silence total";;;;;;;;;;;;;0.0;;;;;;;;;;;;;;;;;;;;;;;;;;;;;" Engin";;;;;;;;;;;;;;;;;;;;;;;;;;;;;;0.0;;;;;;;;;;;;;;;;;;;;;;;;;;0;;;;;;;;;;;;;;;;;;;;;;;;1;"Un seul";;;;;"Observation en continu";;
50;1956-04-00036;195;0;;1956.04.07;"LONDE (LA) (76) 08.04.1956 Ti2";;;;;2;T;4;"20 - 29 ans";H;;;;;;"66. Ouvriers non qualifies";;;;;;;;;;;;;;;;;;;;O;6026;;2;1956309831;56700497;;;164;1;;1;;;;1956;04;08;"1956-04-08 23:45:00";23:45;;;23:45:00;0;;;;;;"LONDE (LA)";76500;76;;;;;;;Ciel;49.3;1;0.0;"chemin vicinal 1 vers la"" verte Londe""";"Territoires artificialises - Zones industrielles ou commerciales et reseaux de communication - Reseaux routier et ferroviaire et espaces associes";;;;;;"""bas de l' Ourail""";;;;;;;180.00;;"Chg direction, niveau de vol";"durant 2 e 3 minutes";;;;"Variable (acceleration, deceleration, etc.) (valeur conservee pour compatibilite: utiliser la nature de la trajectoire)";"1,50 metresur 0,60m";;;;"Emotion - Curiosite, Interet - Actif";1;;;;;;"Soleil ou Nuit claire";;;;;disque;"Autre forme non categorisee";disque;;"Objet unique";;Rouge;;Inconnue;;;"Aucun, Silence total";;;;;;;;;;;;;0.0;;;;;;;;;;;;;;;;;;;;;;;;;;;;;" Engin";;;;;;;;;;;;;;;;;;;;;;;;;;;;;;0.0;;;;;;;;;;;;;;;;;;;;;;;;;;0;;;;;;;;;;;;;;;;;;;;;;;;1;"Un seul";;;;;"Observation en continu";;
51;1956-11-00037;202;0;;1956.11.01;"PARIS (75) 15.11.1956";;;;;1;T;;;H;;;;;;"36. Cadres d'entreprise";;;;;;;;;;;;;;;;;;;;O;5753;;1;1956309639;56700496;;;171;1;;1;;;;1956;11;15;"1956-11-15 19:05:00";19:05;;;19:05:00;0;;;sup15s;;;PARIS;75000;75;;;;;;;Ciel;48.9;2.4;0.1;Paris;"Territoires artificialises - Zones urbanisees";;;;;135.00;"120e e 130e";;"40 e 45 degres";;;;;45.00;;"Lineaire ou Rectiligne";"la deuxieme boule a un changement de direction";;;" 5e e 10e par seconde";Rapide;"3millimetre e bout de bras";;;;"Emotion - Curiosite, Interet - Actif";1;;;;;;"Soleil ou Nuit claire";;;;;boule;"3D - 2 axes de symetrie - Spherique, Boule";"une boule rouge vif donnant naissance e une deuxieme boule de meme dimension avec trajectoire differente";" Phenomene";"Objet unique";;Rouge;;"Intensite - Forte ou lumineux, ex: ampoule (mag. -15 e -10)";;;Inconnu;;;;;;;;;;;;;0.0;;;;;;;;;;;;;;;;;;;;;;;;;;;;;;;;;;;;;;;;;;;;;;;;;;;;;;;;48;;2;0.0;;;;;;135.00;"120e e 130e";;"40 e 45 degres";;;;;;"Lineaire ou Rectiligne";;;;;;;;;;;0;;;;;;;;;;;;;;;;;;;;;;;;1;"puis fragementation";;;;;"Observation en continu";;
52;1957-01-00038;204;0;;1957.01.01;"HADJOUT (DZ.42) 03.01.1957";;;;;1;T;;;H;;;;;;"32. Cadres de la fonction publique, professions intellectuelles et  artistiques";;;;;;;;;;;;;;;;;;;;O;5750;;1;1957309637;57800494;;;172;1;;1;;;;1957;01;03;"1957-01-03 21:22:00";21:22;;;21:22:00;0;;;15s;;;HADJOUT;42200;DZ.42;;;;;;;Ciel;;;0.0;"en vol";;;;;;45.00;;;"Bas sur l'horizon. hauteur angulaire 10e vers 5e";;;-3492;;45.00;;Descendante;;;;" 4e+ou-par seconde d'apres les temoins - calcul d'apres direction et duree 180e:15s =12e par seconde";;;;;;"Emotion - Curiosite, Interet - Actif";1;;;;;;Inconnu;;;;;obus;"Autre forme non categorisee";;" Termes descriptifs (lumieres, forme, etc.)";"Traenee, Queue";;;;"Intensite - Forte ou lumineux, ex: ampoule (mag. -15 e -10)";;;Inconnu;;;;;;;;;;;;;0.0;;;;;;;;;;;;;;;;;;;;;;;;;;;;;;;;;;;;;;;;;;;;;;;;;;;;;;;;;;;0.0;;;;;;225.00;;;"Bas sur l'horizon. 5e";;;;270.00;;Descendante;;;;;;;;;;;0;;;;;;;;;;;;;;;;;;;;;;;;1;"Un seul";;;;;"Observation en continu";;
54;1957-10-00040;9318;0;2017.10.35;;"AMBLY-FLEURY (08) 30.10.1957";;;"La brigade de Rethel a declare avoir vu comme une lueur rouge.";2;1;T;;;F;AMBLY-FLEURY;08130;08;FR;;;NP;;NP;;NP;;NP;;;NP;NP;NP;NP;NP;NP;NP;;;;O;;;;1957311492;;;;9111;1;;1;;;;1957;10;30;"1957-10-30 23:50:00";23:50;;;;0;;;;;;AMBLY-FLEURY;08130;08;FR;;;;;;Ciel;49.5;4.5;1.4;;;;;;;;;;;;;;;;;;;;;;;;;;;Inconnu;;;;;;;;;;;;;;;;"Objet unique";;;;;;;;;;;;;;;;;;;;0.0;;;;;;;;;;;;;;;;;;;;;;;;;;;;;;;;;;;;;;;;;;;;;;;;;;;;;;;;;;;0.0;;;;;;;;;;;;;;;;;;;;;;;;;;;;;;;;;;;;;;;;;;;;;;;;;;;;;;;;;;
54;1957-10-00040;9317;0;2017.10.34;;"LOUVERGNY (08) 30.10.1957";;;"A 23h40, 4 militaires de la brigade de LE CHESNE sont temoins d'un phenomene etrange. Ils remarquent une lueur rouge en direction de l'ouest. A 23h50, ils observent un disque rouge d'un diametre apparent de 1 metre, sous un angle d'environ 30e, toujours en direction de l'ouest. Au bout de quelques minutes, ils leur semblent que le disque se separe en deux parties au 2/3 de la hauteur, la partie superieure disparaet. A minuit, les 2/3 du disque est encore visible. Pas de bruit, pas de mouvement pendant l'observation.";1;1;T;;;H;LOUVERGNY;08390;08;FR;;;;;;;;;;;;;;;;;;;;;;O;;;;1957309638;57305772;;"TAMPON : 57305772";9110;1;;1;;;;1957;10;30;"1957-10-30 23:40:00";23:40;;;;0;;;20m;;;LOUVERGNY;08390;08;FR;;;;;;Ciel;49.6;4.7;1.7;;;;;;;;;;;;;;;;;;;;;;;;;;;"Emotion - Curiosite, Interet - Actif";;;;;;;;;;;;;;;;"Objet unique";;;;;;;;;;;;;;;;;;;;0.0;;;;;;;;;;;;;;;;;;;;;;;;;;;;;;;;;;;;;;;;;;;;;;;;;;;;;;;;;;;0.0;;;;;;;;;;;;;;;;;;;;;;;;;;;;;;;;;;;;;;;;;;;;;;;;;;;;;;;;;;
54;1957-10-00040;205;0;;1957.10.01;"NOVY-CHEVRIERES (08) 30.10.1957";;;"Le commandant de la Brigade d'Amagne Lucquy et plusieurs autres gendarmes en stationnement sur la route nationale ont leur attention attiree par un engin lumineux ayant la forme d'un cigare  se deplaeant direction Nord-Sud, puis brusquement l'engin fait un ecart e gauche soit direction Est. Il se stabilise au-dessus de la commune  de Novy-Chevriere, puis il repart en direction Sud-Ouest. ";1;1;T;;;H;;;;;;"41. Professions intermediaires de l'enseignement, de la sante, de la fonction publique et assimiles";;;;;;;;;;;;;;;;;;;;O;5751;;1;1957311492;;;;173;1;;1;;;;1957;10;30;"1957-10-30 23:50:00";23:50;;;23:50:00;0;;;;"3 e 45s";;NOVY-CHEVRIERES;8300;08;FR;;;;;;Ciel;49.5;4.4;0.0;"au lieu dit Beausejour sur la commune de Louvergny";"Territoires agricoles";;;;;270.00;;;;;;;;0.00;;"Stationnaire, Immobile";;;;;Inconnu;"diametre de 1 metre";;;;"Emotion - Curiosite, Interet - Actif";1;;;;;;Inconnu;;;;;disque;"Autre forme non categorisee";;" Phenomene";"Objet unique";;Rouge;;Inconnue;;;"Aucun, Silence total";;;;;;;;;;;;;0.0;;;;;;;;;;;;;;;;;;;;;;;;;;;;;;;;;;;;;;;;;;;;;;;;;;;;;;;;;;;0.0;;;;;;;;;;;;;;;;;;;;;;;;;;0;;;;;;;;;;;;;;;;;;;;;;;;1;"Un seul";;;;;"Observation en continu";;
54;1957-10-00040;206;0;;1957.10.02;"PAUVRES (08) 31.10.1957";;;"Quatre militaires de la brigade MACHAULT, dont le chef de Poste se trouvaient en service sur la R.N. 46 entre PAUVRES et MAZAGRAN, quand l'un d'eux a vu un objet de petites dimensions se dirigeant approximativement dans le Sud-Est - Nord-Ouest et suivant sa trajectoire e une vitesse extremement grande.
Cet objet se remarquait par une brillance importante, nettement plus grande que celle des etoiles environnantes, et presentait des reflets verts.
L'observation a dure quelques dizaines de secondes";2;1;T;;;H;;;;;;;;;;;;;;;;;;;;;;;;;;O;5752;;2;1957309638;57305772;;;174;1;;1;;;;1957;10;31;"1957-10-31 01:30:00";01:30;;;23:50:00;0;;;10s;;;PAUVRES;8300;08;FR;;;;;;Ciel;49.4;4.5;0.1;"sur la [RN 46] entre PAUVRES (08) et MAZAGRAN (08)";"Territoires agricoles";;;;;135.00;;;;;;;;270.00;;"Sans chg direction";;;;;Rapide;;;;;"Emotion - Curiosite, Interet - Actif";1;;;;;;Inconnu;;;;;;;;" Phenomene";"Objet unique";;Vert;;Inconnue;;;Inconnu;;;;;;;;;;;;;0.0;;;;;;;;;;;;;;;;;;;;;;;;;;;;;;;;;;;;;;;;;;;;;;;;;;;;;;;;;;;0.0;;;;;;;;;;;;;;;;;;;;;;;;;;0;;;;;;;;;;;;;;;;;;;;;;;;1;"Un seul";;;;;"Observation en continu";;
55;1957-12-00041;207;0;;1957.12.01;"[AERO CTL] COGNAC (16) 17.12.1957 T1";;"[AERO CTL]";"Echos radar sur scope";;1;T;1;;H;;;;;;"32. Cadres de la fonction publique, professions intellectuelles et  artistiques";;;;;;;;;;;;;;;;;;;;O;5749;;1;1957309636;57700466A;;;175;1;;1;;"[AERO CTL]";;1957;12;17;"1957-12-17 16:01:00";16:01;;;16:01:00;0;;;30s;;;COGNAC;16100;16;;;;;;;Autre;45.7;-0.3;0.0;"base militaire radart de surveillance de Cognac";"Territoires agricoles";;;;;;"scope radar";;"inferieure e 30000 pieds";;;20;;180.00;;Inconnu;;;;" 2880 km /h";;;;;;"Emotion - Curiosite, Interet - Actif";;;;;;;"Bancs de brouillard";;;;;"echo radar";"Autre forme non categorisee";"echos radar ronds  sur scope";Autre;"Objets multiples";;;;Inconnue;;;Inconnu;;;;;;;;;;;;;0.0;;;;;;;;;;;;;;;;;;;;;;;;;;;;;;;;;;;;;;;;;;;;;;;;;;;;;;;;45;;;0.0;;;;;;;;;;;;;;;;;;;;;;;;;;0;;;;;;;;;;;;;;;;;;;;;;;;1;"Un seul";;;;;"Observation en continu";;
55;1957-12-00041;208;0;;1957.12.02;"[AERO CTL] COGNAC (16) 27.12.1957 T2";;"AERO CTL";"Echos radar sur scope";;1;T;2;;F;;;;;;"51. Employes de la fonction publique";;;;;;;;;;;;;;;;;;;;O;7699;;1;1957309636;57700466;;;176;1;;1;;"[AERO CTL]";;1957;12;27;"1957-12-27 14:30:00";14:30;;;14:30:00;0;;;;;;COGNAC;16100;16;;;;;;;Autre;45.7;-0.3;0.0;"contrele local aerien de la B.A 135 de cognac";;;;;;;20e;;;;;20;;;;;;;;;;;;;;"Emotion - Curiosite, Interet - Actif";;;;;;;Inconnu;;;;;;;"echo radar rond";;"Objet unique";;;;"Intensite - Tres forte, brillante, ex: projecteur puissant (mag. -20 e -15)";;;;;;;;;;;;;;;;0.0;;;;;;;;;;;;;;;;;;;;;;;;;;;;;;;;;;;;;;;;;;;;;;;;;;;;;;;;;;;0.0;;;;;;;;;;;;;;;;;;;;;;;;;;;;;;;;;;;;;;;;;;;;;;;;;;1;"Un seul";;;;;;;
56;1959-03-00042;38;0;;1953.03.01;"TOMBOUCTOU (ML.06) 20.03.1953";;;;;1;T;;;H;;;;;;"41. Professions intermediaires de l'enseignement, de la sante, de la fonction publique et assimiles";;;;;;;;;;;;;;;;;;;;O;5748;;1;1959309635;;;;35;1;;1;;;;1953;03;20;"1953-03-20 20:15:00";20:15;;;20:15:00;0;;;;;;TOMBOUCTOU;;ML.06;;;;;;;Ciel;16.8;3;0.0;"10km du puit de TOUIL (Mali)";"Territoires artificialises - Zones industrielles ou commerciales et reseaux de communication - Reseaux routier et ferroviaire et espaces associes";;;;;315.00;330e;;"Bas sur l'horizon. 10e";;;;;45.00;;"Stationnaire, Immobile";;;;;"Nulle, Immobile, Stationnaire";Venus;;;;"Emotion - Curiosite, Interet - Actif";1;;;;;;Inconnu;;;;;circulaire;"3D - 2 axes de symetrie - Spherique, Boule";;" Phenomene";"Objet unique";;"Orange, feu";;"Intensite - Forte ou lumineux, ex: ampoule (mag. -15 e -10)";;;Inconnu;;;;;;;;;;;;;0.0;;;;;;;;;;;;;;;Autre;"en mouvement";;;;;;;;;;;;;;;;;;;;;;;;;;;;;;;;;;;;;;;;16.8;;3;0.0;;;;;;315.00;;;;;;;;;;;;;;Lente;;;;;;0;;;;;;;;;;;;;;;;;;;;;;;;1;"Un seul";;;;;"Observation en continu";;
57;1959-09-00043;209;0;;1959.09.01;"SALI (DZ.01) 14.09.1959";;;"Le 14 septembre 1959 e 5h10-15 du matin trois temoins au sud de Sali (Algerie) sont intrigues par les evolutions d'un corps lumineux de couleur orange dans le ciel. A 5h30 l'objet s'immobilise. Durant 40 minutes ils constatent que le corps derive lentement vers le NE en changeant frequemment d'aspect et de couleur (rouge e une extremite). L'observation se fait aux jumelles. Aucune trainee et aucun bruit n'ont ete constates. L'observation durera environ une heure au total.
Une autre observation est notee sur le rapport. Il est decrit pour le 12 septembre 1959 e 19h l'observation d'un phenomene de couleur orange et d'un diametre apparent d'une etoile situe e tres haute altitude et se deplaeant e grande vitesse de 180e e 360e en 30 secondes environ. Aucun son particulier n'est remarque.";1;1;T;;;H;;;;;;"32. Cadres de la fonction publique, professions intellectuelles et  artistiques";;;;;;;;;;;;;;;;;;;;O;5747;;1;1959309634;59800503;;;177;1;;1;;;;1959;09;14;"1959-09-14 05:00:00";05:00;;;05:00:00;0;;;;inf.1h;;SALI;118;01;DZ;;;;;;Ciel;27;-0.1;10.0;"piste des palmeraies e 15 km au sud de SALI (Algerie)";"Territoires artificialises - Zones industrielles ou commerciales et reseaux de communication - Reseaux routier et ferroviaire et espaces associes";;;;;90.00;"piste des palmeraies e 15 km au sud de SALI";;;;;;;0.00;;"Courbe - Arabesques (boucles)";;;;;Lente;;;;;"Emotion - Curiosite, Interet - Actif";1;;;;;;Inconnu;;;;;"changement de forme";"Autre forme non categorisee";"corps lumineux sans trainee";" Phenomene";"Objet unique";;"Orange, feu";;"Intensite - Forte ou lumineux, ex: ampoule (mag. -15 e -10)";;;"Aucun, Silence total";;;;;;;;;;;;;0.0;;;;;;;;;;;;;;;;;;;;;;;;;;;;;;;;;;;;;;;;;;;;;;;;;;;;;;;;;;;0.0;;;;;;;;;;;;;0.00;;Inconnu;;;;;;;;;;;1;;;;;;;;;;;;;;;;;;;;;;;;1;"Un seul";;;;;"Observation en continu";;
58;1959-11-00044;211;0;;1959.11.01;"DAKAR (SN.DK) 24.11.1959";;;;;1;T;;;H;;;;;;"36. Cadres d'entreprise";;;;;;;;;;;;;;;;;;;;O;5746;;1;1959309633;59800502;;;178;1;;1;;;;1959;11;24;"1959-11-24 20:20:00";20:20;;;20:20:00;0;;;5m;;;DAKAR;;SN.DK;;;;;;;Ciel;;;0.0;"sur une pilotine e l'arret dans le port d Dakar puis dans un bureau pour prendre les jumelles puis dans la pilotine en marche";"Surfaces en eau";;;;;225.00;;;"15 degres de hauteur";;;-3492;;225.00;;"Lineaire ou Rectiligne";;;;" augmentation  progressive de la vitesse";"Variable (acceleration, deceleration, etc.) (valeur conservee pour compatibilite: utiliser la nature de la trajectoire)";"diametre angulaire de 2eou3e";;;;"Emotion - Curiosite, Interet - Actif";1;;;;;;Inconnu;;;;;;"Sans forme precise";"centre lumineux compose de points lumineux et halo";" Termes descriptifs (lumieres, forme, etc.)";"Halo(s) lumineux";;;;"Intensite - Forte ou lumineux, ex: ampoule (mag. -15 e -10)";;;Inconnu;;;;;;;;;;;;;0.0;;;;;;;;;;;;;;;;;;;;;;;;;;;;;;;;;;;;;;;;;;;;;;;;;;;;;;;;;;;0.0;;;;;;225.00;;;6e;;;;;;Descendante;;;;;;;;;;;0;;;;;;;;;;;;;;;;;;;;;;;;1;"Un seul";;;;;"Observation discontinue";;
59;1960-07-08172;213;0;2012.01.08;1960.--.01;"WISSOUS (91) --.--.1960";;;"TEMOIGNAGE RECENT D'UNE OBSERVATION ANCIENNE - le temoin relate l'observation d'une goutte de feu, ventrue, blanche (ou bleuetre) descendre e la verticale d'un nuage lors d'une apres-midi ou l'orage menaeait.  Le mouvement dure quelques secondes et la boule disparaet derriere un rideau d'arbres voisin. Les nuages sont particulierement bas.MPD pas  de date precise donnees par temoin sur base archives date arbitraire au 01.01.1960";;1;T;;"10 - 19 ans";H;NANCY;54000;54;FR;;"3. Cadres et professions intellectuelles superieures";;;;;;;;;;"excitation d'etre le temoin d'un tel phenomene pour la 1er fois de ma vie";"en a parle";"A l'epoque ""foudre en boule""  aujourd'hui : e la recherche d'explications ou de cas semblables";;non;;;;;;O;6994;;1;1960110531;;1442;"WISSOUS (91) --.--.1960";179;1;;1;;;;1960;--;--;"1960-06-15 12:00:00";;;;;16891200;;5;3s;00:00:03;;WISSOUS;91320;91;FR;;;;;;Ciel;48.7;2.3;0.0;"Perron du pavillon 'elevation d'un demi etage)";"Territoires artificialises - Zones urbanisees";;;;;45.00;EST-NORD-EST;;5e;900m;"<1000m (eloignee)";48;;180.00;" Wissous";Descendante;descente;;;" ""ni lent ni rapide""";;NP;;;;"Emotion - Curiosite, Interet - Passif";1;;Direct;;non;"bavardage avec sa mere";"Variable ; Pluies et Orage";"ciel gris plombe, pre orageux";;"aucune etoile visible";;"goutte (surmontee d'une partie verticale effilee)";"Autre forme non categorisee";"""goutte de feu""";Autre;"Objet unique";"lumiere intense et froide type plasma";Blanc;"de meme couleur qu'un eclair";"Intensite - Forte ou lumineux, ex: ampoule (mag. -15 e -10)";NP;NP;"Aucun, Silence total";;;;;;;;;;;;;0.0;;;;;;;;;;;;;;;Descendante;;;;;;;;;;;;;;;;;;;;;;;;;;;;;;;;;;;;;;;;;48;;2;0.0;;;;;;;"bois de Montjean";;"vers le bas ";;;;180.00;" bois de Montjean";Descendante;;;;;;;;;;;0;"disparition derriere un rideau d'arbres";;;;;;;;;;;;;;;;;;;;;;NP;1;"Un seul";;;;;"Observation en continu";;NP
61;1960-04-02014;215;0;2008.11.03;1960.04.02;"PIERREFORT (15) --.04.1960 T1";;;"observation par deux enfants de 10 et 13 ans d'un engin  en forme d'assiette renverse: partie infrieure avec aspect gazeux. Prsence d'ouvertures en hublots rectangulaires lumineux";;1;T;1;"10 - 19 ans";H;;;;;;"7. Retraites";;;;;;;;;;;;;;;;;;;;O;6570;;1;1960110164;;41;"PIERREFORT (15) --.04.1960 T1";181;1;;1;;;;1960;04;--;"1960-04-15 07:30:00";7:30;;;;1296000;;;;;Inconnu;PIERREFORT;15230;15;FR;;;;;;"Paysage Rural";44.9;2.8;0.0;"route communale entre LA ROCHETTE et PIERREFORT (15230)";"Territoires artificialises - Zones industrielles ou commerciales et reseaux de communication - Reseaux routier et ferroviaire et espaces associes";;;;;;"NON PRECISE";;;;;;;0.00;;Inconnu;;;;" "" ce sont des engins qui sont dans l'espace temps. Ils n'ont pas de vitesse dans le sens oe on imagine vitesse """;;"""c'etait tout sauf petit""";;;;;1;;;;;;"Soleil ou Nuit claire";;;;;"assiette creuse renversee avec hublots rectangulaires lumineux";"Autre forme non categorisee";;" Engin";"Objet unique";;;;Inconnue;;"""silence total""";"Aucun, Silence total";;;;;;;;;;;;;0.0;;;;;;;;;;;;;;;;;;;;;;;;;;;;;;;;;;;;;;;;;;;;;;;;;;;;;;;;;;;0.0;;;;;;;;;;;;;0.00;;Inconnu;;;;;;;;;;;;;;;;;;;;;;;;;;;;;;;;;;;1;"Un seul";;;;;"Observation en continu";;
61;1960-04-02014;216;0;;1960.04.03;"PIERREFORT (15) --.04.1960 T2";;;;;2;T;1;;H;;;;;;"7. Retraites";;;;;;;;;;;;;;;;;;;;O;6571;;2;1960110164;;;;182;1;;1;;;;1960;04;--;"1960-04-15 07:30:00";07:30;;;07:30:00;1296000;;;"qq m";;;PIERREFORT;15230;15;;;;;;;"Paysage Rural";44.9;2.8;0.0;;"Territoires artificialises - Zones industrielles ou commerciales et reseaux de communication - Reseaux routier et ferroviaire et espaces associes";;;;;;"entre le bois de Chabridet et la Margeride";;;;;;;0.00;;Autre;"circonvolutions dans le ciel";;;;Inconnu;;;;;;1;;;;;;Inconnu;;;;;;"3D - 2 axes de symetrie - Spherique, Boule";"""boule brillante laissant echapper d'autres spheres lumineuse qui tournoyaient autour puis semblaient reintegrer la boule initiale""";" Termes descriptifs (lumieres, forme, etc.)";"Objet unique";;;;"Intensite - Forte ou lumineux, ex: ampoule (mag. -15 e -10)";;;Inconnu;;;;;;;;;;;;;0.0;;;;;;;;;;;;;;;;;;;;;;;;;;;;;;;;;;;;;;;;;;;;;;;;;;;;;;;;;;;0.0;;;;;;;;;;;;;;;;;;;;;;;;;;0;"""elle disparut vers l'horizon EST""";;;;;;;;;;;;;;;;;;;;;;;;"De 1 e 10";;;;;"Observation en continu";;
65;1960-11-00048;223;0;;1960.11.01;"LONDE (LA) (76) 13.11.1960 T1";;;;;1;T;1;;H;"LONDE (LA)";76500;76;FR;;"5. Employes";;;;;;;;;;;;;;;;;;;;O;5745;;1;1960309632;60305978;;"ELBEUF (76) 13.11.1960";189;1;;1;;;;1960;11;13;"1960-11-13 02:45:00";02:45;;;02:45:00;0;;;20m;;;"LONDE (LA)";76500;76;;;;;;"observaton d'un engin qui atterrit puis stationne au sol et decolle";Ciel;49.3;1;0.0;;"Territoires artificialises - Zones urbanisees";;;;;;"La Londe, lieu dit ""les 17 pilles"" voie ferree desafectee Rouen Le Mans e La LONDE (76)";;;"150 metres";"<100m (proche)";128;;180.00;" voie ferree desafectee Rouen Le Mans e La LONDE (76)";Descendante;;;;;Inconnu;"diametre de 5 e 6 metres sur 2 metres de hauteur";;;;"Emotion - Curiosite, Interet - Actif";1;;;;;;"Soleil ou Nuit claire";;;;;"engin de forme ronde avec trepied et hublots. Presence d'ailerons";"3D - 2 axes de symetrie - Spherique, Boule";;" Engin";"Objet unique";;;"feux verts clignotants";Inconnue;;;"Aucun, Silence total";;;;;;;;;"Paysage Rural";;;;0.0;;;;;;;;;;;;;;;"Stationnaire, Immobile";;;;;;;;;;;;;;;;;;;;;;;;;;;;;;;;;;;;;;;;Ciel;43.1;;6.2;0.0;;;;;;225.00;;;;;;;;;Montante;;;;;;;;;;;0;;;;;;;;;;;;;;;;;;;;;;;;1;"Un seul";;;;;"Observation en continu";;
65;1960-11-00048;224;0;;1960.11.02;"LONDE (LA) (76) 13.11.1960 T2";;;;;2;T;2;;F;"LONDE (LA)";76500;76;FR;;"5. Employes";;;;;;;;;;;;;;;;;;;;O;7347;;2;1960309632;60305978;;"ELBEUF (76) 13.11.1960";190;1;;1;;;;1960;11;13;"1960-11-13 03:00:00";03:00;;;03:00:00;0;;;;;;"LONDE (LA)";76500;76;;;;;;;Ciel;49.3;1;0.0;chambre;"Territoires artificialises - Zones urbanisees";;;;;;"fenetre de la chambre";;;;;128;;0.00;;Inconnu;;;;;Inconnu;;;;;"Emotion - Curiosite, Interet - Passif";1;;;;;;Inconnu;;;;;;"1D - Faisceau, Trait";"lumieres de couleur";" Termes descriptifs (lumieres, forme, etc.)";"Objets multiples";;Multicolore;;Inconnue;;;Inconnu;;;;;;;;;;;;;0.0;;;;;;;;;;;;;;;;;;;;;;;;;;;;;;;;;;;;;;;;;;;;;;;;;;;;;;;;43.1;;6.2;0.0;;;;;;;;;;;;;;;;;;;;;;;;;;1;;;;;;;;;;;;;;;;;;;;;;;;;;;;;;"Observation en continu";;
67;1963-11-01791;226;0;2008.04.12;1963.11.01;"PREMESQUES (59) 11.11.1963";;;"un seul temoignage pour trois temoins/ BOULE BLANCHE OSCILLANTE DISPARITION FULGURANTE DANS LE CIEL [...]  Phenomene ayant l'apparence d'une grosse etoile, plus etendu et lumineux que Venus";;1;T;;;H;;;;;;"82. Inactifs divers (autres que retraites)";;;;;;;;;;;;;;;;;;;;O;7005;;1;1963110542;;229;"ARMENTIERES (59) 1963";192;1;;1;;;;1963;11;11;"1963-11-11 15:00:00";15:00;;;15:30:00;0;;;;;;PREMESQUES;59840;59;FR;;;;;;Ciel;50.7;3;0.0;"petit chemin goudronne perpendiculaire e la route menant e Premesque";"Territoires artificialises - Zones industrielles ou commerciales et reseaux de communication - Reseaux routier et ferroviaire et espaces associes";;;;;;ONO;;20e;;"<10000m (tres eloignee)";;;90.00;;"Stationnaire, Immobile";;;;;"Nulle, Immobile, Stationnaire";"diametre apparent egal ou superieur au quart de celui de la lune approximativement 1 e 2 mm e bout d";;;;"Emotion - Curiosite, Interet - Actif";1;;;;;;"Quelques eclaircies ou Nuageux";;;;;;"3D - 2 axes de symetrie - Spherique, Boule";"boule lumineuse e bord flou";Autre;"Objet unique";;"Orange, feu";"impression de scintillation";"Intensite - Forte ou lumineux, ex: ampoule (mag. -15 e -10)";;;"Aucun, Silence total";;;;;;;;;;;;;0.0;;;;;;;;;;;;;;;Courbe;;;;;"Variable (acceleration, deceleration, etc.) (valeur conservee pour compatibilite: utiliser la nature de la trajectoire)";;;;;;;;;;;;;;;;;;;;;;;;;;;;;;;;;;;;50;;2;0.0;;;;;;;;;;;;;180.00;" dans les nuages";Montante;;;;;Fulgurante;;;;;;0;;;;;;;;;;;;;;;;;;;;;;;;1;"Un seul";;;;;"Observation en continu";;
68;1964-03-01780;227;0;;1964.02.01;"BOURGET-DU-LAC (LE) (73) --.02.1964";;;"Temoignage recent 21/06/2007 d'une observation ancienne (date imprecise premier quinzaine du mois) :

 Rentrant e la base ecole du Bourget vers 2h30 du matin un dimanche debut mars, le temoin s'etonnera d'apercevoir  une faible lueur de courte duree e environ 200 ou 300 m de lui. Se rapprochant du grillage du terrain militaire, il voit 5 silhouettes evoluant pres d'un engin pose au sol. La partie haute de l'objet, eclairee par la lueur, est arrondie. Les silhouettes font des allers-retours de l'interieur de l'objet e son environnement immediat. Brusquement la lueur s'eteint et dans un silence total l'objet s'eleve d'un metre ou deux du sol et reste stationnaire durant une e deux secondes. Le temoin decrit alors l'objet comme ayant une forme ronde ou ovale, le dessous plat, le dessus bossele au centre et sur les cotes. Ses dimensions sont de 8 e 10 m de diametre et sa hauteur de 2,50m e 3 m. Cet objet s'eleve verticalement sans transition e tres grande vitesse vers le sud. Aucun bruit n'est entendu et une sorte de trainee verticale breve apparaet ainsi que deux autres traces dans le ciel. Le lendemain le temoin se rendra sur les lieux de son observation et bien que separe d'une dizaine de metres du lieu exact par le grillage de la base militaire, il constate un leger tassement de l'herbe et de quelques arbustes. Il decide de ne parler e personne de cette observation.";;1;T;;"20 - 29 ans";H;TOURS;37100;37;FR;;"7. Retraites";;;;;;;;;non;NP;NP;NP;NP;NP;NP;NP;;;;O;6372;;1;1964110004;;;;193;1;;1;;;;1964;02;--;"1964-02-15 02:30:00";02:30;;;02:12:00;1296000;;;;"sup. 20m";;"BOURGET-DU-LAC (LE)";73370;73;FR;;;;;"terrain militaire";Autre;45.6;5.9;0.0;"en bordure de la BA 725";"Territoires artificialises - Zones industrielles ou commerciales et reseaux de communication - Reseaux routier et ferroviaire et espaces associes";;;;;;"BA 725";;sol;NP;"<100m (proche)";245;;0.00;;Montante;"ascendante , en courbe";;;;Fulgurante;"8 e 10 m de diametre et2,50 e 3m de haut";;;;"Emotion - Curiosite, Interet - Actif";1;;Direct;;;conduit;"Tres nuageux ou couvert";;;;;lueur;"3D - 2 axes de symetrie - Ovoede";lumieres+silhouettes+objet;" Termes descriptifs (lumieres, forme, etc.)";"Autres artefacts";;;;Inconnue;;;"Aucun, Silence total";;;;;;;;;;;;;0.0;;;;;;;;;;;;;;;;;;;;;;;;;;silhouettes;;;" Objet";;;;;;;;;;;;;;;;;;;;;;;;;;;;;;0.0;;;;;;;"Sud Chambery";;ciel;;;;;;;;;;;;;;;;;0;"le PAN";"masse sombre";;;Autre;;;;;;;;;;;;;;;;;;;;"2 lueurs  5 silhouettes   1 objet";;;;;"Observation en continu";;
70;1965-07-00050;230;0;;1965.07.01;"VALENSOLE (04) 01.07.1965";;;;;1;T;;"40 - 49 ans";H;;;;;;"69. Ouvriers agricoles";;;;;;;;;;;;;;;;;;;;O;5942;;1;1965309761;65305974C;;;196;1;;1;;;;1965;07;01;"1965-07-01 05:45:00";05:45;;;05:45:00;0;;;;;;VALENSOLE;4210;04;FR;;;;;;"Paysage Rural";43.8;6;0.1;"champ de jeunes pieds de lanvande";"Territoires agricoles";"Elevations - Plateau";;;;;"quartier de l'Olivol (coordonnees UTM 387-589(31TGJ)";;;"le temoin indique 60m (pv 445) ;les gendarmes mesurent l'emplacement du temoin e 90m de la la trace (PV 105) puis dans le PV 145 le temoin declare s'etre approche e 7 metres de l'appareil";"<50m (tres proche)";575;;180.00;;"Stationnaire, Immobile";;;;;"Nulle, Immobile, Stationnaire";voiture;;;;"Emotion - Curiosite, Interet - Actif";1;;;;;;Inconnu;;;;;;"3D - 2 axes de symetrie - Ovoede ; Forme Biologique -  Etres biologiques";"engin et rencontre du troisieme type et constataion de traces au sol";" Engin";"Echelle, Rampe d'acces ; Porte, Ouverture ; Bosse, Protuberance, Deme ;  ; Objet unique";;"Gris clair";mat;Inconnue;;;"Type - Mecanique - Sifflement";;;;;;;;;;;;;0.0;;;;;;;;;;;;;;;Montante;;;;;Rapide;;;;;;;;;Autre;;;;;;;;"Type - Mecanique - Sifflement";;;;;;;;;;;;;;;;;;;;;;0.0;;;;;;;;;;;;;;;;;;;;;;;;;;0;;;;;;;;;;;;;;;;;;;;;;;;1;"Un seul";;;;;"Observation en continu";;
71;1965-07-02381;232;0;2009.08.15;1965.07.03;"DE MOUSTIERS-SAINTE-MARIE (04) vers MANOSQUE (04) --.07.1965";;;"Le temoin, age de 15 ans e l'epoque, et son frere ont observe, depuis l'arriere de leur voiture, une grosse assiette renversee dans un champ de lavande. Des enfants etaient sortis de cette assiette. Le temoin fait reference au cas Valensole. Il ne peut pas precisement dater son observation. Dessin demande.";;1;T;;"10 - 19 ans";H;;;;;;"82. Inactifs divers (autres que retraites)";;;;;;;;;;;;;;;;;;;;O;7463;;1;1965110965;;852;;198;1;"MP /attention aucune precision sur le lieu exact d'observation";2;;;;1965;07;--;"1965-07-15 19:15:00";"19h00 19h30";;;18:00:00;1296900;;;;;Inconnu;VALENSOLE;4210;04;;;;;;;"Paysage Rural";43.8;6;0.1;;"Territoires artificialises - Zones industrielles ou commerciales et reseaux de communication - Reseaux routier et ferroviaire et espaces associes";;;;;;"NON PRECISE";;;;;43;;90.00;;"Stationnaire, Immobile";;;;;"Nulle, Immobile, Stationnaire";;"2.2 < x < 6e ou ""Grande""";;;"Emotion - Curiosite, Interet - Actif";1;;;;;;Inconnu;;;;;"grosse assiette retournee";"Autre forme non categorisee";"grosse assiette retournee d'oe sortent des enfants";" Objet";"Objet unique";;;;Inconnue;;;Inconnu;;;;;;;;;;;;;0.0;;;;;;;;;;;;;;;;;;;;;;;;;;;;;;;;;;;;;;;;;;;;;;;;;;;;;;;;;;;0.0;;;;;;;;;;;;;90.00;;"Stationnaire, Immobile";;;;;;;;;;;;;;;;;;;;;;;;;;;;;;;;;;;1;"Un seul";;;;;"Observation en continu";;
72;1965-07-02569;231;0;2010.05.09;1965.07.02;"BLOIS (41) 23.07.1965";;;"Le temoin, en compagnie de son pere, ancien mecanicien navigant dans l'armee de l'air, observe un objet d'apparence metallique, en forme de triangle. A noter une centrale nucleaire en construction e 35 km du lieu d'observation. Base aerienne de Tours e 55 km. L'objet etait immobile et en inclinaison constante.  Parfaitement lisse et poli. Fait reference e un article paru dans Nvelle republique centre ouest le 24 juillet 1965.";;1;T;;;H;BLOIS;41000;41;FR;;"82. Inactifs divers (autres que retraites)";;;;;;;;;;;;;;;;;;;;O;7397;;1;1965110907;;1098;;197;1;;1;;;;1965;07;23;"1965-07-23 18:00:00";18H00;;;18:00:00;0;;;05:00;05:00;;BLOIS;41000;41;FR;;;;;;"Paysage Urbain";47.6;1.3;0.0;;"Territoires artificialises - Zones urbanisees";;;;;225.00;S-SO;;"70e sur l'horizon";"entre 30 et 40 km";"<10000m (tres eloignee)";4735;;90.00;;"Stationnaire, Immobile";;;;;"Nulle, Immobile, Stationnaire";"estimee e 150 200m";;;;"Emotion - Curiosite, Interet - Actif";1;;;;;;"Soleil ou Nuit claire";;;;;;"3D - 1 axe de symetrie - Conique";;" Objet";"Objet unique";;;;"Intensite - Forte ou lumineux, ex: ampoule (mag. -15 e -10)";;;"Aucun, Silence total";;;;;;;;;;;;;0.0;;;;;;;;;;;;;;;;;;;;;;;;;;;;;;;;;;;;;;;;;;;;;;;;;;;;;;;;47;;1;0.0;;;;;;225.00;S-SO;;"70e sur l'horizon";;;;90.00;;"Stationnaire, Immobile";;;;;;;;;;;0;;;;;;;;;;;;;;;;;;;;;;;;1;"Un seul";;;;;"Observation en continu";;
74;1965-08-02422;234;0;2009.09.29;1965.08.02;"BEAUVAIS (60) --.08.1965";;;"Observation d'une sphere apparue dans le ciel, au dessus d'un chantier, sur plusieurs jours lors de travaux de demolition d'une cheminee.";;1;T;;;H;OROER;60510;60;FR;;"3. Cadres et professions intellectuelles superieures";;;;;;;;;;;;;;;;;;;;O;6656;;1;1965110241;;893;"BEAUVAIS (60) --.08.1965";200;1;;1;;;;1965;08;--;"1965-08-15 12:00:00";;;;;1339200;;;;"plusieurs jours";Inconnu;BEAUVAIS;60000;60;;;;;;;Ciel;49.4;2.1;0.0;;"Territoires artificialises - Zones urbanisees";;;;;90.00;;;30e;5km;"<10000m (tres eloignee)";49;;90.00;;"Stationnaire, Immobile";;;;;"Nulle, Immobile, Stationnaire";"une boule de petanque e un metre";;;;;1;;;;;;"Soleil ou Nuit claire";;;;;;"3D - 2 axes de symetrie - Spherique, Boule";boule;Autre;"Objets multiples";;;"""contraste mais n'emetait pas de lumiere""";"Type - Nature: autre";;;"Aucun, Silence total";;;;;;;;;;;;;0.0;;;;;;;;;;;;;;;;;;;;;;;;;;;;;;;;;;;;;;;;;;;;;;;;;;;;;;;;49;;2;0.0;;;;;;;;;;;;;;;;;;;;;;;;;;0;;;;;;;;;;;;;;;;;;;;;;;;1;"Un seul";;;;;"Observation discontinue";;
108;1969-10-02635;287;0;2010.09.03;1969.10.04;"NANTES (44) 08.10.1969";;;"Temoignage recent d'une observation tres ancienne d'un point lumineux en plein ciel. Le temoin regarde e travers une lunette d'observation et constate qu'il s'agit d'un engin en forme de disque comportant deux ronds lumineux sous le dessous, sorte de satellites accompagnant l'objet principal. . L'engin a disparu tres rapidement apres que le temoin ait cesse quelques instants son observation.";;1;T;;"10 - 19 ans";H;MARSEILLE;13009;13;FR;;"5. Employes";;;;;;;;;;;;;;;;;;;;O;6888;;1;1969110449;;1170;"NANTES (44) 08.10.1969";251;1;;1;;;;1969;10;08;"1969-10-08 07:10:00";07h10;;;;0;;;"20 min";;;NANTES;44000;44;;;;;;;"Paysage Urbain";47.2;-1.6;0.1;"dans le jardin";"Territoires artificialises - Zones urbanisees";;;;;225.00;S-SO;;"entr 60e et 70e";"""quelques milliers de metres d'altitude""";"<10000m (tres eloignee)";47;;0.00;;Autre;"""mouvement de va et vient sur une droite de longueur angulaire de 30e""";;;;Lente;"""je l'ai compare en diametre apparent e une fois et demi Saturne anneau compris """;;;;"Emotion - Curiosite, Interet - Actif";1;;;;;;"Soleil ou Nuit claire";;;;;disque;"3D - 2 axes de symetrie - Spherique, Boule";"point, etoile, disque, systeme,engin";" Termes descriptifs (lumieres, forme, etc.)";"Objet unique";;;;"Intensite - Forte ou lumineux, ex: ampoule (mag. -15 e -10)";;"""silence matinal""";;;;;;;;;;;;;;0.0;;"Territoires artificialises - Zones urbanisees";;;;;;;;;;;;;;;;;;;;;;;;;;;;;;;;;;;;;;;;;;;;;;;;;;;;;;47;;-1;0.0;;;;;;;;;;;;;135.00;;;;;;;;;;;;;0;"""disparition du phenomene""";;;;;;;;;;;;;;;;;;;;;;;1;"Un seul";;;;"""en continue sauf dans les dernieres secondes""";"Observation en continu";;
112;1970-01-01778;293;0;;1970.--.01;"FORT-DE-FRANCE (972) --.--.1970";;;;;1;T;;;H;;;;;;;;;;;;;;;;;;;;;;;;;;O;6370;;1;1970110002;;;;256;1;;1;;;;1970;--;--;"1970-06-15 22:00:00";22:00;;;22:00:00;16848000;;;3/5s;;;FORT-DE-FRANCE;97200;972;;;;;;;Ciel;14.6;-61.1;0.0;;"Territoires artificialises - Zones urbanisees";;;;;90.00;;;;"max 3 km";"<10000m (tres eloignee)";;;270.00;;"Lineaire ou Rectiligne";rectiligne;;;" vitesse extraordinaire";Fulgurante;"tres grosse etoile";"x < 0.04e ou ""Ponctuelle""";;;"Emotion - Curiosite, Interet - Actif";1;;;;;;"Soleil ou Nuit claire";;;;;boule;"3D - 2 axes de symetrie - Spherique, Boule";lumiere;" Termes descriptifs (lumieres, forme, etc.)";"Objet unique";;;;"Intensite - Claire, moyenne, ex: pleine lune (mag. -10 e -5) ";;;"Aucun, Silence total";;;;;;;;;;;;;0.0;;;;;;;;;;;;;;;;;;;;;;;;;;;;;;;;;;;;;;;;;;;;;;;;;;;;;;;;;;;0.0;;;;;;;;;;;;;;;;;;;;;;;;;;0;;;;;;;;;;;;;;;;;;;;;;;;1;"Un seul";;;;;"Observation en continu";;
120;1970-01-01784;304;0;;1970.07.01;"(DPT) LANDES (40) --.07.1970";;;;;1;T;;;H;;;;;;"5. Employes";;;;;;;;;;;;;;;;;;;;O;6380;;1;1970110011;;;;266;1;;1;;;;1970;07;--;"1970-07-15 21:00:00";21:00;;;21:00:00;1296000;;;2m;;;;;40;;;;;;;Ciel;;;0.0;;"Territoires agricoles";;;;;315.00;;;60e;"300 e 400m";"<1000m (eloignee)";;;135.00;;Autre;"deplacement en ligne brisee et ligne droite puis ascension";;;;"Variable (acceleration, deceleration, etc.) (valeur conservee pour compatibilite: utiliser la nature de la trajectoire)";"6 e 8 M diametre pour le premier et 30m de long pour le second";;;;"Emotion - Curiosite, Interet - Actif";1;;;;;;"Soleil ou Nuit claire";;;;;"forme d'une soucoupe et cigare";"Autre forme non categorisee";aeronef;Autre;"Objets multiples";;Blanc;;"Intensite - Forte ou lumineux, ex: ampoule (mag. -15 e -10)";;;"Aucun, Silence total";;;;;;;;;;;;;0.0;;;;;;;;;;;;;;;;;;;;;;;;;;;;;;;;;;;;;;;;;;;;;;;;;;;;;;;;;;;0.0;;;;;;;;;;;;;;;;;;;;;;;;;;0;;;;;;;;;;;;;;;;;;;;;;;;;2;;;;;"Observation en continu";;
128;1971-11-08602;318;0;2013.06.24;1971.11.01;"NEUVES-MAISONS (54) 02.11.1971";;;"temoignage recent observation ancienne - le temoin (6 ans et demi e l'epoque) relate l'observation (d'abord e 20h -20:10 puis rectification dans L'EC) d'une soucoupe plutet statique, evoluant e basse altitude, muni de deux rangees de hublots, dont on peut voir l'interieur qui semble vide. la soucoupe semble tourner sur elle meme. Aucun bruit decelable alors qu'elle vole e basse altitude, survole le temoin et disparait dans le lointain.";1;1;T;;"0 - 9 ans";H;BOURMONT;52150;52;FR;;"31. Professions liberales et assimiles";NSP;3;NSP;3;NSP;4;NSP;4;non;"La e surprise e en zone A , pendant les premieres secondes , je ne comprends pas , j'essaye de trouver une explication logique. ( sensation un peu identique lorsque l'on croise par hasard, dans la vraie vie , une celebrite vue au cinema ou e la television) .Tres vite , je prends conscience du caractere exceptionnel du phenomene , je pense immediatement e soucoupes volantes e e martiens e e extra-terrestres . Je suis e la fois fascine et je ne veux pas louper ce spectacle unique , mais je ressens aussi de l' e apprehension e ( mais aucune panique ) :
peur de ce phenomene inconnu (sans imaginer une eventuelle agression ) et peur de ne pas etre cru quand je raconterai mon observation .
Je cherche a interpeller des adultes qui pourront etre temoins eux aussi : revenir sur mes pas dans la salle des sports risquait de me faire manquer la suite de l'observation  Je pense e me diriger e la gendarmerie qui est peu eloignee mais la peur du gendarme m'en dissuade , je ne croise aucun passant e cette heure ci , il me paraet dangereux d'arreter un conducteur , mais je montre le PAN e une voiture qui passait . Ensuite il y a une periode de e plaisir e de l'observation ou j'essaye de profiter de ce e cadeau du ciel e J'essaye de bien memoriser le tout et de voir ce qui se passe e l'interieur de l'objet : c'est une phase de plaisir et de fascination. ( zone B et C ) Ensuite je fais le choix de regagner en courant mon domicile ( et de temps en temps en marche arriere ) tout en gardant les yeux au ciel ( contact visuel perdu en zone D ) En e quittant e ce que j'appelle e ma soucoupe e , j'ai la sensation de quitter quelque chose qui va me manquer , il y a de la e tristesse e mais je suis heureux et e fier e d'avoir pu etre au bon endroit et au bon moment et d'avoir assiste e un spectacle unique . Je retrouve cette sensation e la fin d'un concert dans une grande salle .
Ensuite, excitation, deception, interrogations ( detailles par la suite )";"Je perd le contact visuel et rejoins le domicile de mes parents , dans le but :
de les prevenir au plus vite
de me sentir plus en securite
de me rendre au 3 e etage de la maison et poursuivre si possible l'observation
de prendre des photos si possible
Croquis de votre observation
CNES/GEIPAN Questionnaire standard GEIPAN V3.5-juin-2013 page : 12
J'arrive e mon domicile , mes parents et 2 autres membres de ma famille ( oncle et tante ) me voient arriver tres excite et je les met rapidement au courant de la situation. Leur scepticisme me surprend et je monte , seul , au 3 e etage  je suis deeu de ne plus rien voir , le PAN n'est plus visible. Je suis deeu de ne pas etre pris au serieux par ma famille et je n'en parle plus.
J'en ai parle des le lendemain avec Frederic Vauthier , pour confronter nos souvenirs .
Je me souviens bien lui avoir dit e la double rangee de hublots qui tournent , tu les as bien vues toi aussi ! e
A la reprise de la classe , apres les vacances de la Toussaint , je pense en avoir parle e ma voisine de classe , Dalila ( nom de famille oublie) ce qui provoque peu d'enthousiasme et je n'insiste pas plus. ( certitude e 80 % )
J ai surveille la presse durant quelques jours .
Lors de l'entrainement de handball suivant, j'en ai parle aux copains d'entrainement en esperant que d'autres temoins confirmeraient notre observation : tout le monde se moque gentillement , y compris notre entraineur , Mr Francis DIDIER.
2 semaines apres le jour de l'observation MR DIDIER me presente ses excuses et m'apprend qu'une e petite grand-mere e de la Cite de la Plaine lui a fait un temoignage identique au mien . (le jour , l'heure d'observation, le lieu, la description de l'objet vu de plus loin , tout concordait ) Mr DIDIER est la seule personne qui a pris mon temoignage au serieux ( + celui de Frederic et de la personne agee ) Je regrette aujourd'hui ne ne pas avoir cherche e rencontrer cette dame , rappellons que je n'avais que 6 ans e et demi ! e 
J'en ai parle quelques mois plus tard e un copain de voisinage , Guy Phillibert qui sur le coup m'a ecoute avec serieux et interet. Le lendemain , il me dit que ce que j'ai vu ne pouvait pas etre vrai car son pere n'y croyait pas ! Je trouve son revirement assez stupefiant et pueril ( bon, lui aussi avait 7 ou 8 ans , mais quand meme ! )
J' ai fait un temoignage ecrit au journal OKAPI en 1974 / 1975 , sans resultat .
Depuis 1971 / 1972 , de peur du ridicule , des deceptions et des frustrations que cela provoque ,
je n'en avais pratiquement plus parle e personne .
Depuis environ 2 / 3 ans , j'en parle plus volontiers quand le sujet de conversation s'y prete.
Ce n'est que depuis le mois d'aoet 2013 que je suis bien decide, avec votre aide, de faire des recherches plus approfondies . En septembre , j'en ai reparle e tous les protagonistes de l'epoque avec + ou  de surprises ";"J'ai tout de suite pense e un engin extra-terrestre , une e soucoupe volante e . Puis rapidement apres ( vers 9 /10 ans ) l'hypothese d'etres humains venant du futur me semblait une alternative qui tenait la route . Depuis les annees 90 , plus conscient des realites des distances inter-stellaires , de la relativite espace  temps  vitesse , je m'oriente plus sur l'hypothese de e voyageurs du temps e humains ou extra-terrestres . Il y a le facteur espace  temps - vitesse qui complique enormement toute sorte d'interpretation simple et facilement comprehensible.
Dans tous les cas , ces e visiteurs e sont des sortes d'archeologues et / ou de scientifiques .
Si on raisonne en plus , physique quantique et intrication , toutes les interpretations les plus invraisemblables sont possibles .
Pour simplifier , il peut s'agir :
* d'humains ou d'extra-terrestres venant d'un passe tres lointain ( ils voyageraient donc dans le futur )
* d'extra- terrestres contemporains ( tele-portation et /ou base secrete indispensable )
* d'humains ou d'extra-terrestres venant d'un futur lointain ( ils voyageraient donc dans le passe )
et pourquoi pas un e mix e de toutes ces combinaisons , de quoi effectivement renoncer e comprendre ! ! !";"Je suis ne fin 1964 en plein programme Apollo : fusees , cosmonautes, voyages inter-planetaires , tous ces mots faisaient parti du quotidien et les medias en parlaient constamment . Les boites de ravioli ( Buitoni ) , les stations services ( Shell ) etc  donnaient en cadeau des diapositives ou medailles sur le sujet qui ont renforce mon goet pour les voyages spatiaux du moment.
Durant ces annees , la television et les journaux ont relate des temoignages de PAN que l'enfant que j'etais a entendu avec interet . Les images cinematographiques que j'avais vues des e soucoupes e etaient toujours accompagnees de sifflements, bruits stridents ou autres. Le fait qu'il n'y ai aucun bruit etait en decallage par rapport e l'idee que j'avais du phenomeme .
On parlait de e soucoupes volantes e , le terme et les images etait bien dans les tetes , et je voulais y croire sans trop y croire car on a toujours tendance e ne pas croire celui qui temoigne ( meme aujourd'hui , et avec le vecu mon observation , j'ai tendance e ne pas forcement croire un eventuel temoignage , c'est bizarre et je ne me l'explique pas )
CNES/GEIPAN Questionnaire standard GEIPAN V3.5-juin-2013 page : 14
Deje assez ouvert e tout ce qui touche e l etrange , je voulais croire aux soucoupes comme on croit au Pere Noel . Oui, j'avoue avoir ete ravi de voir cette soucoupe car j'etais vraiment e demandeur e e 100 pour 100 .";"Oui , e 6 / 7 ans et maintenant avec plus de 40 ans de recul  je peux dire que cette observation a ete determinante sur mon avis concernant les phenomenes OVNI ( terme que j'ai entendu pour la premiere fois, plusieurs mois apres mon observation , e la radio ) Mes lectures , mes choix cinematographiques et televisuels, mon attirance pour la science et la haute technologie ont ete largement influencees par cette observation . C'est donc ma vie entiere qui en a ete profondement influence et dans le bon sens , enfin je crois . Mais j'irai plus loin , cette observation a ete aussi une veritable epreuve initiatique : gestion de l'ego , du secret , de l'humilite et en contre partie la revelation que tout est possible et qu'il est bon de garder une certaine naevete d'enfant et d' ouverture d'esprit .
Je pense que ces e visiteurs e preparent en douceur l'opinion avant d'engager un contact direct . Ils attendent que les humains aient atteint un stade de maturite suffisant pour accepter cette intrusion sans reaction dangereuse pour eux comme pour nous . Si leurs intentions etaient belliqueuses , non seulement ils auraient agi depuis longtemps et je pense qu'une civilisation qui atteint un tel stade de technologie ne peut pas avoir des intentions belliqueuses ( ou alors elle s'auto -detruit bien avant ce stade )
S'il s'agit de visiteurs humains e du futur e et que les OVNI sont des machines e remonter le temps alors je pense qu'un contact serait perilleux  mais aurait quand meme lieu si l'humanite etait en danger .
Je pense que la technologie de ces e visiteurs e pourrait leur permettre de passer incognito , de faeon invisible. C'est de faeon deliberee qu'ils se montrent mais , pas trop longtemps , pas trop souvent , juste dans le but que les temoignages nous habituent decennies apres decennies e leur presence.
D'autre part , je me demande si la complexite et la variete des PAN ne poursuivent pas le meme but : embrouiller l'esprit de l'observateur ( pleins de couleurs et de mouvements dans tous les sens ) ce qui rend la description difficile . Dans la meme logique je me demande si chaque apparition ne donne pas lieu e une nouvelle e espece e d' OVNI , le encore pour rendre les choses un peu plus compliquees et embrouiller cette fois- ci l'esprit collectif.";"Oui , je me souviens avoir dit cela e un camarade ( Guy Phillibert ) , j'ai meme rajoute que les phenomenes inexpliques et paranormaux le seront un jour ( je pensais e la telepathie entre autre ) quand j'ai dit cela , j'avais 7 ans et je pensais qu'en l'an 2000 environ tout serait elucide  patience 
Pour etre plus exact ce n'est pas la science qui donnera forcement une explication e mon observation car ce n'etait pas un phenomene naturel comme une meteorite ou un nuage lenticulaire .
Le contour net , le deplacement lent et qui suit le un trajet centre sur la rue et surtout les hublots en rotation excluent , pour moi, tout autre explication que celle d'un engin extra-terrestre et / ou terrestre et venant d'un autre temps que le notre .
CNES/GEIPAN Questionnaire standard GEIPAN V3.5-juin-2013 page : 15
Le phenomene ne sera explique que lorsque les civilisations qui sont e l'origine de ces engins decideront de rentrer directement en contact avec le monde entier.
La Relativite d'Einstein , la physique quantique et les decouvertes du futur nous donnent et nous donneront des cles qui nous permettront de comprendre les observations vues e travers le monde  Pour l'instant , le phenomene OVNI reste la plus grande enigme de tous les temps !";"Oui, il pense que cette observation lui a permis d'etre ce qu'il est aujourd'hui et y est pour quelque chose dans sa vie professionnelle. ";;;;O;;;;1971150241;;1909;;280;1;;1;;;;1971;11;02;"1971-11-02 19:25:00";19:10/19:40;;;;900;;;"1 m";"~ 1 mn";"< 1 mn";NEUVES-MAISONS;54230;54;FR;;;;;"carrefour de ville";"Paysage Urbain";48.4;6.1;2.4;"carrefour urbain (Au carrefour de la rue du Capitaine Caillon , de la rue Aristide Briand et de la rue de la Haute Borne)";"Territoires artificialises - Zones urbanisees";"Plaines - Littoral - Fluvial";"4.4 Sport";19h10/19h40;"< 1 mn";110.00;"Precisement au carrefour de la rue du Capitaine Caillon , de la rue Aristide Briand et de la rue de la Haute Borne . En face du restaurant l'Union . ";22.00;"45 e au debut de l'observation , 90e au milieu , 60e e la fin .";"20 e 50 m . Aucun obstacle visuel . 50 m lors du premier contact visuel . 20 m au plus pres lorsque nous sommes passe sous le PAN en zone C , environ au niveau du passage pieton protege qui existait en 1971 . En zone D, le PAN etait de nouveau e environ 5";"<50m (tres proche)";301;" Tres proche, bas. une dizaine de metres.";0.00;"Pres du lampadaire";"Lineaire ou Rectiligne";"Le PAN suivait precisement la partie centrale de la route . Il a donc decrit une legere courbe ( voir plan ) puis il a continue en ligne droite. Entre le point A et D , le PAN a pris de l altitude : 20 m au debut 30 m e la fin";"Interaction - Temoin - Rapprochement du temoin";;Lentement.;"Tres lente";"Un empans d'un main adulte , soit environ 20 cm e bout de bras";"2.2 < x < 6e ou ""Grande""";"plus gros que la lune";"Aucune odeur particuliere";"Emotion - Curiosite, Interet - Actif";0;;Direct;;voiture;"Sortait hall des sports";"Soleil ou Nuit claire";"Nuit claire,Ciel degage , soleil couche , pas de vent , il faisait assez froid";2;"Pas de souvenir , les lumieres ambiantes citadines etaient de toute faeon trop intenses , la nuit etait tombee;Lune presente mais non mentionnee par le temoin";;"lentille biconvexe symetrique , contours nets . En forme de lentille ( la legumineuse ) ";"3D - 1 axe de symetrie - Soucoupe - Soucoupe e coupole";soucoupe;"Termes OVNI (soucoupe, disque, cigare, vaisseau)";"Fenetre(s) ou Hublot(s) ; Lumieres clignotantes";"Couleur e majorite blanc lumineux / metal gris mat / jaune orange / Une ou plusieurs lumieres rouges , dans la partie inferieure du PAN . Il y aurait eu , sans en etre certain une accentuation de la couleur rouge e la fin de l'observation. N.B : Ce ne son";Blanc;"Luminosite equivalante e celle d'un phare de port ( Marseille 1972 )";"Intensite - Claire, moyenne, ex: pleine lune (mag. -10 e -5) ";non;"aucun - ";"Aucun, Silence total";"0 - Aucun bruit perceptible";inconnue;"tres basse (~10 m)";"~50 m maxi.";46;6;0.0000000000;;;;;;0.0;;;;;;;;;;"30m de lui au depart";;;;;;;;;;;;;;;;"forme circulaire, discoedale, en forme de 2 ""soucoupes"" accolees tete-beche. ";;;;;"blanc puis rouge e la fin";;"""comme une lampe e iode""";;;;;;;;;;;;;;;;;;;;;;"Paysage Urbain";;;;0.0;"Rue de petite ville";"Territoires artificialises - Zones urbanisees";"Plaines - Littoral - Fluvial";19h10/19h40;"< 1 mn";280.00;"Il semblait descendre legerement en suivant le pont qui surplombe la voie ferree et se dirigeait en direction de PONT-ST-VINCENT .";33.00;"Non definie ;au loin";"""proche""";"<50m (tres proche)";"Tres proche, bas. Une dizaine de metres.";0.00;"Trouee du Trianon";"Lineaire ou Rectiligne";"rectiligne (en ligne droite)";"Interaction - Temoin - Eloignement du temoin";;Lentement.;"Tres lente";"l'estime e quatre e cinq fois celle de la Lune, ou encore e 10 ou 15 metres";"2.2 < x < 6e ou ""Grande""";;"Aucune odeur particuliere";;0;"Cache par les betiments proches.Disparition ""trouee du Trianon"" ";;"3D - 1 axe de symetrie - Soucoupe - Soucoupe e coupole";soucoupe;"Termes OVNI (soucoupe, disque, cigare, vaisseau)";"Fenetre(s) ou Hublot(s) ; Lumieres clignotantes";"""rougeetre""";Blanc;"Moins lumineux";"Intensite - Claire, moyenne, ex: pleine lune (mag. -10 e -5)  ; Intensite - Douce, moderee, ex: etoiles les plus fortes, croissant de lune (mag. -5 e 0)";non;aucun;"Aucun, Silence total";"0 - Aucun bruit perceptible";;;;;;;;;"Un quart du ciel , difficile a evaluer";1;"1 - ""Une soucoupe""";;;;;"Observation en continu";;"lampadaires de rues"
138;1972-12-02331;333;0;2009.07.01;1972.12.01;"HAUTEVILLE-LOMPNES (01) 13.12.1972";;;"Le temoin roulait avec son epouse lorsqu'il a observe un objet lumineux se deplaeant en ligne droite e tres grande vitesse direction sud nord au-dessus de Hauteville et Champdor. A disparu derriere l'horizon. Objet de forme ronde, lumineux mais n'eclairant pas le sol, couleur blanc-jaune bleuetre. Dimension d'une balle de tennis vue e 20m. Pas de bruit. Vitesse estimee par le temoin e 7200 e 14 000 km/h";;1;T;;;H;HAUTEVILLE-LOMPNES;01110;01;FR;;"31. Professions liberales et assimiles";;;;;;;;;;;;;;;;;;;;O;7263;;1;1972110776;;804;"HAUTEVILLE-LOMPNES (01) 13.12.1972";295;1;;1;;;;1972;12;13;"1972-12-13 23:45:00";23:45;;;;0;;;;"qq sec";;HAUTEVILLE-LOMPNES;1110;01;FR;;;;;Hauteville;"Paysage Urbain";46;5.6;0.1;"En voiture, en provenance de Lyon, deviation de Nantuy et Trepont";"Territoires artificialises - Zones industrielles ou commerciales et reseaux de communication - Reseaux routier et ferroviaire et espaces associes";;;;;;"Au dessus d'Hauteville";;;;Inconnu;48;;180.00;;"Lineaire ou Rectiligne";;;;" grande vitesse";Rapide;"A peu pres une balle de tennis vue e 20m";;;;"Emotion - Curiosite, Interet - Passif";1;;;;;;Inconnu;;;;;"Sphere ou disque";"3D - 2 axes de symetrie - Spherique, Boule";"ovnis, lumiere";" Objet";"Objet unique";;Multicolore;phosphorescent;"Intensite - Forte ou lumineux, ex: ampoule (mag. -15 e -10)";;;"Aucun, Silence total";;;;;;;;;;;;;0.0;;;;;;;;;;;;;;;;;;;;;;;;;"Emotion - Curiosite, Interet - Passif";;;;;;;;;;;;;;;;;;;;;;;;;;;;;;;48;;4;0.0;;"Territoires artificialises - Zones industrielles ou commerciales et reseaux de communication - Reseaux routier et ferroviaire et espaces associes";;;"quelques secondes";0.00;;;;;;;45.00;;"Lineaire ou Rectiligne";;;;;Rapide;;;;;;0;;;"3D - 2 axes de symetrie - Spherique, Boule";;" Objet";;;;;"Intensite - Forte ou lumineux, ex: ampoule (mag. -15 e -10)";;;"Aucun, Silence total";;;;;;;;;;;1;"Un seul";;;;;"Observation en continu";;
140;1973-01-01765;334;0;;1973.--.01;"NOUMEA (988) --.--.1973";;;;;1;T;;;H;;;;;;;;;;;;;;;;;;;;;;;;;;O;6357;;1;1973109989;;;;296;1;;1;;;;1973;--;--;"1973-06-15 13:00:00";11:00/15:00;;;13:00:00;16855200;;;2/5m;;;NOUMEA;98800;988;;;;;;;"Paysage Rural";-22.3;166.5;0.1;;"Territoires artificialises - Zones industrielles ou commerciales et reseaux de communication - Reseaux routier et ferroviaire et espaces associes";;;;;45.00;"nord- nord-est";;"Bas sur l'horizon. entre l'horizon et 30e";1,5km;"<10000m (tres eloignee)";;;0.00;;"Stationnaire, Immobile";;;;;"Nulle, Immobile, Stationnaire";;;;;"Emotion - Curiosite, Interet - Passif";1;;;;;;"Soleil ou Nuit claire";;;;;;;;" Termes descriptifs (lumieres, forme, etc.)";"Objets multiples";;Multicolore;;Inconnue;;;Inconnu;;;;;;;;;;;;;0.0;;;;;;;;;;;;;;;;;;;;;;;;;;;;;;;;;;;;;;;;;;;;;;;;;;;;;;;;;;;0.0;;;;;;;;;;;;;;;;;;;;;;;;;;1;;;;;;;;;;;;;;;;;;;;;;;;;5;;;;;"Observation discontinue";;
